BIC_SWIFTCODE;INSTITUTIONNAME;CITYNAME;BRANCHINFO;STATUS;COUNTRYNAME;PHYSICALADDRESS
AAALSARI;SAUDI BRITISH BANK, THE (FORMERLY ALAWWAL BANK);RIYADH;RIYADH;Active;SAUDI ARABIA;RIYADH
AAALSARIJED;SAUDI BRITISH BANK, THE (FORMERLY ALAWWAL BANK);JEDDAH;WESTERN AREA JEDDAH;Active;Saudi Arabia;WESTERN AREA JEDDAH    
AABBSE22;SAAB AB;LINKOPING;LINKOPING;Active;SWEDEN;BRODERNA UGGLAS GATA , H 209, 1   FLOOR 2 
ABANSI2X;NOVA KREDITNA BANKA MARIBOR D.D.;LJUBLJANA;LJUBLJANA;Active;Slovenia;LJUBLJANA    
ABBAZMLU;AB BANK ZAMBIA LTD.;LUSAKA;LUSAKA;Active;ZAMBIA;CAIRO ROAD, STAND 7393 CHAINDA SQUARE  FLOOR 2 
ABBYGB2L;SANTANDER UK PLC;BOOTLE;BOOTLE;Active;UNITED KINGDOM;BOOTLE CENTRE BRIDLE ROAD   
ABBYGB2LANB;SANTANDER UK PLC;LONDON;SANTANDER BUSINESS;Active;UNITED KINGDOM;PRESCOT STREET 21   
ABBYGB3E;SANTANDER UK PLC;LONDON;LONDON;Active;UNITED KINGDOM;PRESCOT STREET 21   FLOOR PRS-LG
ABCADEFF;ARAB BANKING CORPORATION SA FRANKFURT BRANCH;FRANKFURT AM MAIN;ABC ZNL Frankfurt;Active;Germany;ABC ZNL Frankfurt    
ABCBBRSP;BANCO ABC BRASIL S.A.;SAO PAULO;SAO PAULO;Active;BRAZIL;AVENIDA CIDADE JARDIM, ITAIM BI 803 FLOOR 20   
ABCBKYKX;BANCO ABC BRASIL S.A. - CAYMAN ISLANDS BRANCH;GEORGETOWN;GEORGETOWN;Active;CAYMAN ISLANDS;SOUTH CHURCH STREET, 103 HARBOR PLACE   
ABCCGB22;SOVA CAPITAL LIMITED;LONDON;LONDON;Active;UNITED KINGDOM;WOODSTREET 88   FLOOR 12
ABCKMUMU;ABC BANKING CORPORATION LTD;PORT LOUIS;PORT LOUIS;Active;MAURITIUS;MILITARY ROAD, 1 ABC CENTRE  FLOOR 2 
ABCLKENA;AFRICAN BANKING CORPORATION LTD;NAIROBI;NAIROBI;Active;KENYA;WOODVALE GROVE ABC BANK HOUSE  WESTLANDS 
ABCMPHMM;PHILIPPINE NATIONAL BANK (ALLIED BANKING CORPORATION;MANILA;#N/A;Active;PHILIPPINES;#N/A
ABCOBHBM;ARAB BANKING CORPORATION (B.S.C.);MANAMA;MANAMA;Active;Bahrain;MANAMA    
ABCODZAL;ARAB BANKING CORPORATION - ALGERIA;BIR MOURAD RAIS;ALGIERS;Active;ALGERIA;54 AVENUE DES TROIS FRERES BOUADOU BIR MOURAD RAIS   
ABCOFRPP;ARAB BANKING CORPORATION SA;PARIS;AG SIEGE SOCIAL;Active;France;AG SIEGE SOCIAL    
ABCOITMM;ARAB BANKING CORPORATION SA MILAN BRANCH;MILANO;MILANO;Active;Italy;MILANO    
ABCOTNTT;ARAB BANKING CORPORATION;TUNIS;TUNIS;Active;TUNISIA;RUE DU LAC D'ANNECY ABC BUILDING  LES BERGES DU LAC 
ABDIAEAD;ABU DHABI ISLAMIC BANK;ABU DHABI;ABU DHABI;Active;UNITED ARAB EMIRATES;SHEIKH RASHID BIN SAEED STREET    
ABINAEAA;ARAB BANK FOR INVESTMENT AND FOREIGN TRADE;ABU DHABI;HEAD OFFICE;Active;UNITED ARAB EMIRATES;ARBIFT BUILDING HAMDAN STREET  TOURIST CLUB AREA 
ABKKAEAD;AL AHLI BANK OF KUWAIT K.S.C.P, DUBAI BRANCH;DUBAI;DUBAI;Active;UNITED ARAB EMIRATES;BENIYAS STREET DEIRA   
ABKKKWKW;AL AHLI BANK OF KUWAIT K.S.C.P;KUWAIT;KUWAIT;Active;KUWAIT;AHMED AL JABER STREET, SAFAT SQUARE    
ABKLCY2N;ALPHA BANK CYPRUS LTD;NICOSIA;LEFKOSIA;Active;CYPRUS;1 STYLIANOU LENA SQUARE CHILONOS AND GLADSTONOS CORNER   
ABKZKZKX;'KAZKOMMERTSBANK' JSC(FORMERLY 'BTA BANK' JSC);ALMATY;#N/A;Active;KAZAKHSTAN;#N/A
ABLEUS33;NATEXIS BLEICHROEDER INC.;NEW YORK,NY;#N/A;Active;UNITED STATES;#N/A
ABMZMZMA;ABSA BANK MOCAMBIQUE,SA;MAPUTO;MAPUTO;Active;Mozambique;MAPUTO    
ABNAAEAAIPC;ABN AMRO BANK N.V. UNITED ARAB EMIRATES BRANCH;DUBAI;#N/A;Active;UNITED ARAB EMIRATES;#N/A
ABNAAEAD;THE ROYAL BANK OF SCOTLAND PLC UNITED ARAB EMIRATES (FORMERLY KNOWN AS RBS NV);DUBAI;WPS Processing Unit;Active;UNITED ARAB EMIRATES;WPS Processing Unit
ABNAATWW;THE ROYAL BANK OF SCOTLAND PLC AUSTRIA (FORMERLY KNOWN AS RBS NV);VIENNA;VIENNA;Active;AUSTRIA;VIENNA
ABNAAU2B;THE ROYAL BANK OF SCOTLAND N.V. (AUSTRALIA);SYDNEY;#N/A;Active;AUSTRALIA;#N/A
ABNAAU2BGTS;THE ROYAL BANK OF SCOTLAND N.V. (AUSTRALIA);SYDNEY;#N/A;Active;AUSTRALIA;#N/A
ABNABEBR;THE ROYAL BANK OF SCOTLAND PLC BELGIUM (FORMERLY KNOWN AS RBS NV);BRUSSELS;#N/A;Active;BELGIUM;#N/A
ABNABEBRANT;THE ROYAL BANK OF SCOTLAND N.V. (BELGIUM);ANTWERPEN;#N/A;Active;BELGIUM;#N/A
ABNABEBRBRU;THE ROYAL BANK OF SCOTLAND N.V. (BELGIUM);BRUSSELS;#N/A;Active;BELGIUM;#N/A
ABNABRSP;BANCO ABN AMRO S.A.;SAO PAULO;SAO PAULO;Active;BRAZIL;RUA LEOPOLDO COUTO MAGALHAES 700 FLOOR 4   
ABNACATT;THE ROYAL BANK OF SCOTLAND PLC CANADA (FORMERLY KNOWN AS RBS NV);TORONTO;#N/A;Active;CANADA;#N/A
ABNACHZ8;THE ROYAL BANK OF SCOTLAND PLC ZURICH (FORMERLY KNOWN AS RBS NV);ZURICH;ZURICH;Active;SWITZERLAND;ZURICH
ABNACHZ8ZRH;THE ROYAL BANK OF SCOTLAND PLC ZURICH (FORMERLY KNOWN AS RBS NV);ZURICH;#N/A;Active;SWITZERLAND;#N/A
ABNACHZZ80A;ABN AMRO BANK (SWITZERLAND) A.G.;ZURICH;#N/A;Active;SWITZERLAND;#N/A
ABNACNSH;THE ROYAL BANK OF SCOTLAND (CHINA) CO., LTD;SHANGHAI;#N/A;Active;CHINA;#N/A
ABNACNSHBJG;THE ROYAL BANK OF SCOTLAND (CHINA) CO., LTD;BEIJING;#N/A;Active;CHINA;#N/A
ABNACNSHSZN;THE ROYAL BANK OF SCOTLAND (CHINA) CO., LTD;SHENZHEN;#N/A;Active;CHINA;#N/A
ABNACZPP;THE ROYAL BANK OF SCOTLAND PLC CZECH REPUBLIC (FORMERLY KNOWN AS RBS NV);PRAGUE;PRAGUE;Active;CZECH REPUBLIC;PRAGUE
ABNADE55FRA;RBS (DEUTSCHLAND) GMBH;FRANKFURT AM MAIN;#N/A;Active;GERMANY;#N/A
ABNADEFF;THE ROYAL BANK OF SCOTLAND PLC GERMANY (FORMERLY KNOWN AS RBS NV);FRANKFURT AM MAIN;FRANKFURT AM MAIN;Active;GERMANY;FRANKFURT AM MAIN
ABNADEFFFRA;THE ROYAL BANK OF SCOTLAND PLC GERMANY (FORMERLY KNOWN AS RBS NV);FRANKFURT AM MAIN;#N/A;Active;GERMANY;#N/A
ABNADEFFHAM;THE ROYAL BANK OF SCOTLAND PLC GERMANY (FORMERLY KNOWN AS RBS NV);HAMBURG;#N/A;Active;GERMANY;#N/A
ABNADKKK;THE ROYAL BANK OF SCOTLAND PLC DENMARK (FORMERLY KNOWN AS RBS NV);COPENHAGEN;(DANISH) FILIAL;Active;DENMARK;(DANISH) FILIAL
ABNAESMM;THE ROYAL BANK OF SCOTLAND PLC SUCURSAL EN ESPANA (FORMERLY KNOWN AS RBS NV);MADRID;MADRID;Active;SPAIN;MADRID
ABNAFRPP;THE ROYAL BANK OF SCOTLAND PLC FRANCE (FORMERLY KNOWN AS RBS NV);PARIS;AG SIEGE SOCIAL;Active;FRANCE;AG SIEGE SOCIAL
ABNAGB22;THE ROYAL BANK OF SCOTLAND N.V. (UK EQUITIES);LONDON;LONDON;Active;UNITED KINGDOM;LONDON
ABNAGB2L;THE ROYAL BANK OF SCOTLAND PLC LONDON (FORMERLY KNOWN AS RBS NV);LONDON;#N/A;Active;UNITED KINGDOM;#N/A
ABNAGB2P;THE ROYAL BANK OF SCOTLAND N.V. (LONDON);LONDON;LONDON;Active;UNITED KINGDOM;LONDON
ABNAGRAP;THE ROYAL BANK OF SCOTLAND PLC GREECE (FORMERLY KNOWN AS RBS NV);KALLITHEA;#N/A;Active;GREECE;#N/A
ABNAHKAAIPC;ABN AMRO BANK N.V. HONG KONG BRANCH;WEST KOWLOON;(INTERNATIONAL PRIVATE CLIENTS DEPARTMENT);Active;HONG KONG;AUSTIN ROAD WEST, 1    
ABNAHKHH;THE ROYAL BANK OF SCOTLAND PLC, HONG KONG BRANCH (FORMERLY KNOWN AS RBS NV);HONG KONG;Hong Kong Office;Active;HONG KONG;Hong Kong Office
ABNAIDJA;THE ROYAL BANK OF SCOTLAND N.V. JAKARTA BRANCH;JAKARTA;ABN AMRO KC JAKARTA;Active;INDONESIA;ABN AMRO KC JAKARTA
ABNAIE2D;THE ROYAL BANK OF SCOTLAND PLC IRELAND (FORMERLY KNOWN AS RBS NV);DUBLIN;The Royal Bank of Scotland plc Irish Branch;Active;IRELAND;The Royal Bank of Scotland plc Irish Branch
ABNAINBB;NATWEST MARKETS PLC, INDIA BRANCH (FORMERLY KNOWN AS RBS PLC);MUMBAI;MUMBAI;Active;INDIA;14 VEER NARIMAN ROAD    
ABNAINBBCAL;THE ROYAL BANK OF SCOTLAND N.V. (INDIA);KOLKATA (CALCUTTA);#N/A;Active;INDIA;#N/A
ABNAINBBDEL;THE ROYAL BANK OF SCOTLAND N.V. (INDIA);NEW DELHI;#N/A;Active;INDIA;#N/A
ABNAINBBMAS;THE ROYAL BANK OF SCOTLAND N.V. (INDIA);CHENNAI (MADRAS);#N/A;Active;INDIA;#N/A
ABNAJESH;ABN AMRO BANK N.V. JERSEY BRANCH;ST. HELIER;#N/A;Active;JERSEY;#N/A
ABNAJPJT;THE ROYAL BANK OF SCOTLAND PLC TOKYO;TOKYO;#N/A;Active;JAPAN;#N/A
ABNAKRSE;THE ROYAL BANK OF SCOTLAND PLC (SEOUL), FORMERLY KNOWN AS THE ROYAL BANK OF SCOTLAND N.V. (SEOUL);SEOUL;#N/A;Active;KOREA, REPUBLIC OF;#N/A
ABNAKZKX;JSC 'FIRST HEARTLAND JUSAN BANK';ALMATY;ALMATY;Active;Kazakhstan;ALMATY    
ABNAMXMM;THE ROYAL BANK OF SCOTLAND MEXICO, S. A.;MEXICO;MEXICO;Active;Mexico;MEXICO    
ABNAMYKL;THE ROYAL BANK OF SCOTLAND BERHAD (301932-A);KUALA LUMPUR;KUALA LUMPUR;Active;MALAYSIA;KUALA LUMPUR
ABNANL2A;ABN AMRO BANK N.V.;AMSTERDAM;AMSTERDAM;Active;Netherlands;AMSTERDAM    
ABNANL2AALC;ABN AMRO BANK N.V.;AMSTERDAM;ASSET AND LIABILITY MANAGEMENT SUPPORT;Active;Netherlands;ASSET AND LIABILITY MANAGEMENT SUPPORT    
ABNANL2ACLS;ABN AMRO BANK NV;AMSTERDAM;AMSTERDAM;Active;Netherlands;AMSTERDAM    
ABNANL2R;ABN AMRO BANK N.V.;ROTTERDAM;ROTTERDAM;Active;Netherlands;ROTTERDAM    
ABNANL2W;ABN AMRO BANK;;NETHERLANDS;Active;Netherlands;NETHERLANDS    
ABNAPKKA;THE ROYAL BANK OF SCOTLAND LIMITED;KARACHI;#N/A;Active;PAKISTAN;#N/A
ABNAPLPW;RBS BANK (POLSKA) S.A.;WARSZAWA;Centrala;Active;POLAND;Centrala
ABNAPTPLMAD;THE ROYAL BANK OF SCOTLAND N.V. SUCURSAL EM PORTUGAL;MADEIRA;#N/A;Active;PORTUGAL;#N/A
ABNAROBU;THE ROYAL BANK OF SCOTLAND PLC EDINBURGH, ROMANIA BRANCH;BUCHAREST;BUCHAREST;Active;ROMANIA;BUCHAREST
ABNARUMM;ROYAL BANK OF SCOTLAND ZAO;MOSCOW;MOSCOW;Active;RUSSIAN FEDERATION;MOSCOW
ABNASESS;THE ROYAL BANK OF SCOTLAND PLC NORDIC (FORMERLY KNOWN AS RBS NV);STOCKHOLM;STOCKHOLM;Active;SWEDEN;STOCKHOLM
ABNASG2A;ABN AMRO BANK N.V. SINGAPORE BRANCH;SINGAPORE;SINGAPORE;Active;Singapore;SINGAPORE    
ABNASG2ACMB;ABN AMRO BANK N.V. SINGAPORE BRANCH;SINGAPORE;COMMERCIAL AND MERCHANT BANKING;Active;SINGAPORE;25-10 ONE RAFFLES QUAY    
ABNASG2AIPC;ABN AMRO BANK N.V. SINGAPORE BRANCH;SINGAPORE;INTERNATIONAL PRIVATE CLIENTS DEPARTMENT;Active;Singapore;INTERNATIONAL PRIVATE CLIENTS DEPARTMENT    
ABNATHBK;THE ROYAL BANK OF SCOTLAND PLC, BANGKOK BRANCH;BANGKOK;#N/A;Active;THAILAND;#N/A
ABNATRIS;ROYAL BANK OF SCOTLAND PLC TURKEY (FORMERLY KNOWN AS RBS NV);ISTANBUL;#N/A;Active;TURKEY;#N/A
ABNAUS33;THE ROYAL BANK OF SCOTLAND PLC CONNECTICUT (FORMERLY KNOWN AS RBS NV NEW YORK);STAMFORD,CT;STAMFORD,CT;Active;UNITED STATES;STAMFORD,CT
ABNAUS4CFXO;THE ROYAL BANK OF SCOTLAND PLC CONNECTICUT (FORMERLY KNOWN AS RBS NV CHICAGO);STAMFORD,CT;#N/A;Active;UNITED STATES;#N/A
ABNGGB2L;THE ACCESS BANK UK LIMITED;NORTHWICH;LONDON;Active;UNITED KINGDOM;CORNHILL 1   
ABNGGHAC;ACCESS BANK (GHANA) PLC;ACCRA;ACCRA;Active;GHANA;0000 STARLETS 91 ROAD OPPOSITE OHENE DJAN STADIUM -   
ABNGNGLA;ACCESS BANK PLC;VICTORIA ISLAND;VICTORIA ISLAND;Active;NIGERIA;DANMOLE STREET, OFF IDEJO STRE, 999C - VICTORIA ISLAND -   
ABNYUS33;NEW YORK COMMUNITY BANK;WESTBURY;Westbury;Active;United States;Westbury    
ABOCAEAD;AGRICULTURAL BANK OF CHINA (DIFC BRANCH);DUBAI;DUBAI;Active;UNITED ARAB EMIRATES;DUBAI    
ABOCCNBJ;AGRICULTURAL BANK OF CHINA, THE;BEIJING;HEAD OFFICE;Active;China;HEAD OFFICE    
ABOCCNBJ020;AGRICULTURAL BANK OF CHINA, THE;TIANJIN;TIANJIN BRANCH;Active;CHINA;Hexi    
ABOCCNBJ060;AGRICULTURAL BANK OF CHINA, THE;SHENYANG;LIAONING BRANCH;Active;CHINA;27, Qingnian North Street    
ABOCCNBJ090;AGRICULTURAL BANK OF CHINA, THE;SHANGHAI;SHANGHAI BRANCH;Active;CHINA;518, Yan'an East Road    
ABOCCNBJ100;AGRICULTURAL BANK OF CHINA, THE;NANJING;JIANGSU BRANCH;Active;CHINA;357, Hongwu Road    
ABOCCNBJ117;AGRICULTURAL BANK OF CHINA, THE  - SHAOXING BRANCH;SHAOXING;#N/A;Active;CHINA;#N/A
ABOCCNBJ160;AGRICULTURAL BANK OF CHINA, THE;ZHENGZHOU;HENAN BRANCH;Active;CHINA;50, Longhai West Road    
ABOCCNBJ260;AGRICULTURAL BANK OF CHINA, THE;XI'AN;SHAANXI BRANCH;Active;CHINA;64, Nanguan Main Street    
ABOCCNBJ380;AGRICULTURAL BANK OF CHINA, THE;QINGDAO;QINGDAO BRANCH;Active;CHINA;19, Shandong Road    
ABOCCNBJ390;AGRICULTURAL BANK OF CHINA, THE;NINGBO;NINGBO BRANCH;Active;CHINA;518, Zhong Shan Dong Lu    
ABOCCNBJ410;AGRICULTURAL BANK OF CHINA, THE;SHENZHEN;SHENZHEN BRANCH;Active;CHINA;5008, Shennan East Road    
ABOCCNBJ999;AGRICULTURAL BANK OF CHINA, THE;BEIJING;RMB AND PRECIOUS METALS SETTLEMENT;Active;CHINA;100 XISANHUAN BEILU HAIDIAN DISTRICT  JIJYU PLAZA FLOOR 3
ABOCHKHH;AGRICULTURAL BANK OF CHINA LIMITED HONG KONG BRANCH;CENTRAL;CENTRAL;Active;HONG KONG;CONNAUGHT ROAD, 50 AGRICULTURAL BK OF CHINA TOWER  FLOOR 25 
ABOCSGSG;AGRICULTURAL BANK OF CHINA LIMITED, SINGAPORE BRANCH;SINGAPORE;SINGAPORE;Active;SINGAPORE;TEMASEK BOULEVARD, 7 SUNTEC TOWER 1  30 01/02/03
ABPAPKKA;ALLIED BANK LIMITED;LAHORE;ABL, HEAD OFFICE SWIFT UNIT;Active;Pakistan;GARDEN TOWN BR    
ABQQQAQA;AHLI BANK QSC;DOHA;MAIN BRANCH;Active;QATAR;SUHAIM BIN HAMAD STREET   ALSADD AREA 
ABSAGB2L;ABSA BANK LIMITED;LONDON;LONDON;Active;UNITED KINGDOM;LONDON
ABSAZAJJ;ABSA BANK LIMITED;JOHANNESBURG;ALL SOUTH AFRICAN OFFICES;Active;SOUTH AFRICA;ABSA TOWER WEST FLOOR 7  15 TROYE STREET 
ABSAZAJJAIS;ABSA BANK LIMITED;JOHANNESBURG;ABSA INVESTOR SERVICES;Active;SOUTH AFRICA;TROYE STREET, 15 ABSA TOWER WEST  FLOOR 7 
ABSAZAJJTRS;ABSA BANK LIMITED;JOHANNESBURG;JOHANNESBURG;Active;SOUTH AFRICA;JOHANNESBURG    
ABSLRUMM;ABSOLUT BANK;MOSCOW;MOSCOW;Active;Russian Federation;MOSCOW    
ABYSETAA;BANK OF ABYSSINIA;ADDIS ABABA;ADDIS ABABA;Active;ETHIOPIA;ADDIS ABABA   LEGEHAR OWN HQ BUILDING 
ACCCGHAC;CALBANK PLC;ACCRA;ACCRA;Active;GHANA;INDEPENDENCE AVENUE, 23    
ACLBKHPP;ACLEDA BANK PLC.;PHNOM PENH;PHNOM PENH;Active;CAMBODIA;PREAH MONIVONG BLVD, 61   SANGKAT SRAH CHORK KHAN DAUN PENH
ACLRAU2S;AUSTRACLEAR LIMITED;SYDNEY;SYDNEY;Active;AUSTRALIA;ROYAL NAVEL HOUSE 30 GROSVENOR STREET   
ACTTPRSJ;TBB INTERNATIONAL BANK CORP.;SAN JUAN;SAN JUAN;Active;PUERTO RICO;AVE JUAN PONCE DE LEON, 221 PLAZA  FLOOR 11 
ADAGGB2S;THE ROYAL BANK OF SCOTLAND PLC TRADING AS ADAM AND CO.;EDINBURGH;EDINBURGH;Active;UNITED KINGDOM;ST ANDREW SQUARE 36   
ADCBAEAA;ABU DHABI COMMERCIAL BANK;ABU DHABI;ABU DHABI;Active;UNITED ARAB EMIRATES;SALAM STREET    
ADCBAEAATRY;ABU DHABI COMMERCIAL BANK;ABU DHABI;TREASURY SETTLEMENTS;Active;UNITED ARAB EMIRATES;ABU DHABI MALL TOURIST CLUB STREET   
ADCBEGCX;ABU DHABI COMMERCIAL BANK - EGYPT ADCB EGYPT;GIZA;GIZA;Active;EGYPT;GAMAET AL-DOWAL AL-ARABIA, 16   MOHANDESEEN 
ADCBINBB;ABU DHABI COMMERCIAL BANK;MUMBAI;RTGS-HO;Active;India;RTGS-HO    
ADCNAEAA;ABU DHABI INVESTMENT COUNCIL COMPANY PJSC;ABU DHABI;ABU DHABI;Active;UNITED ARAB EMIRATES;ABU DHABI    
ADIABE22;KBC BANK N.V. BC DIAMANT;ANTWERPEN;ANTWERPEN;Active;Belgium;ANTWERPEN    
ADICAEAA;INVEST AD;ABU DHABI;ABU DHABI;Active;UNITED ARAB EMIRATES;ABU DHABI    
ADINAEAA;ABU DHABI INVESTMENT AUTHORITY;ABU DHABI;ABU DHABI;Active;UNITED ARAB EMIRATES;211 CORNICHE STREET    
ADPCUS33;ADP CLEARING AND OUTSOURCING SERVICES INC.;NEW YORK,NY;NEW YORK,NY;Active;United States;NEW YORK,NY    
ADSEAEA1;ABU DHABI SECURITIES EXCHANGE;ABU DHABI;ABU DHABI;Active;UNITED ARAB EMIRATES;AL GHAITH TOWER HAMDAN STREET   
AEBAGRAA;AEGEAN BALTIC BANK S.A.;MAROUSI;MAROUSI;Active;GREECE;MEGALOU ALEXANDROU, 91 AND 25TH MARTIOU STR.   
AEIBGRAX;AMERICAN EXPRESS BANKING CORP;ATHENS;#N/A;Active;GREECE;#N/A
AETCUS55;AMERICAN EXPRESS TRAVEL RELATED SERVICES COMPANY, INC. (TRAVELERS CHEQUE);NEW YORK;NEW YORK;Active;UNITED STATES OF AMERICA;200 VESEY STREET    
AFBLMUMU;AFRASIA BANK LIMITED;PORT LOUIS;PORT LOUIS;Active;MAURITIUS;DR FERRIERE STREET, 10 IBL BUILDING, BOWEN SQUARE   
AFDBCIAB;AFRICAN DEVELOPMENT BANK;ABIDJAN;ABIDJAN;Active;COTE D'IVOIRE;10-12 AVENUE JOSEPH ANOMA    
AFDEUGKA;EAST AFRICAN DEVELOPMENT BANK;KAMPALA;KAMPALA;Active;UGANDA;NILE AVENUE, 4    
AFFCNGLA;AFRICA FINANCE CORPORATION;LAGOS;LAGOS;Active;NIGERIA;OSBORNE ROAD, 3A   IKOYI 
AFKBTRIS;TURKIYE FINANS KATILIM BANKASI A.S.;ISTANBUL;ISTANBUL;Active;TURKEY;SOKULLU CAD. 6 SARAY MAHALLESI, UMRANIYE   
AFRCZAJJ;AFRICAN BANK LIMITED;JOHANNESBURG;JOHANNESBURG;Active;SOUTH AFRICA;59 16TH ROAD MIDRAND   
AFRIBFBF;BANK OF AFRICA - BURKINA FASSO;OUAGADOUGOU;OUAGADOUGOU;Active;BURKINA FASO;AVENUE DE LA RESISTANCE DU 17 MAI 770   
AFRIBJBJ;BANK OF AFRICA - BENIN;COTONOU;COTONOU;Active;Benin;COTONOU    
AFRICIAB;BANK OF AFRICA - COTE D'IVOIRE;ABIDJAN;ABIDJAN;Active;COTE D'IVOIRE;SMGL 11 AVENUE JOSEPH ANOMA   
AFRIFRPP;BOA-FRANCE;PARIS;AG FRANCE SIEGE;Active;France;AG FRANCE SIEGE    
AFRIKENX;BANK OF AFRICA KENYA LTD;NAIROBI;NAIROBI;Active;KENYA;TAIFA ROAD REINSURANCE PLAZA   
AFRIMGMG;BANK OF AFRICA MADAGASCAR;ANTANANARIVO;ANTANANARIVO;Active;MADAGASCAR;2 PLACE DE L'INDEPENDANCE    
AFRIMLBA;BANK OF AFRICA - MALI;BAMAKO;BAMAKO;Active;Mali;BAMAKO    
AFRINENI;BANK OF AFRICA NIGER;NIAMEY;NIAMEY;Active;NIGER;IMMEUBLE BOA RUE DU GAWEYE   
AFRISNDA;BANK OF AFRICA-SENEGAL;DAKAR;DAKAR;Active;SENEGAL;RESIDENCE EXCELLENCE AVENUE LEOPOLD SEDAR SENGHOR, 4 -   
AFRIUGKA;BANK OF AFRICA-UGANDA LTD.;KAMPALA;Head Office;Active;Uganda;Head Office    
AFRNIE2D;ANP INTERNATIONAL FINANCE LTD;DUBLIN;#N/A;Active;IRELAND;#N/A
AFXMEGCA;AFRICAN EXPORT IMPORT BANK;CAIRO;HEAD OFFICE;Active;EGYPT;EL MAAHAD EL ESHTERAKY STREET 72(B)   
AGBKBDDH;AGRANI BANK LIMITED;DHAKA;DHAKA;Active;BANGLADESH;DILKUSHA C/A 9D   
AGBLLT2X;LUMINOR BANK AS LITHUANIAN BRANCH;VILNIUS;Luminor Bank AS Lietuvos skyrius;Active;Lithuania;Luminor Bank AS Lietuvos skyrius    
AGIBTJ22;AGROINVESTBANK OPEN JOINT STOCK COMPANY;DUSHANBE;DUSHANBE;Active;TAJIKISTAN;PR SAADY SHEROZI 21    
AGMOMNUB;KHAN BANK LLC;ULAANBAATAR;ULAANBAATAR;Active;MONGOLIA;KHAN BANK TOWER 6 CHINGGIS AVENUE  STADIUM ORGIL 1 
AGRICHGG;CA INDOSUEZ (SWITZERLAND) SA;GENEVA;ALL SWISS OFFICES;Active;Switzerland;ALL SWISS OFFICES    
AGRIEGCX;CREDIT AGRICOLE EGYPT;CAIRO;HEAD OFFICE;Active;EGYPT;- 5TH SETTLEMENT    
AGRIFRPP;CREDIT AGRICOLE SA;MONTROUGE;HEAD OFFICE;Active;France;HEAD OFFICE    
AGRIFRPP812;CREDIT AGRICOLE;ALBI;ALBI;Active;FRANCE;219 AVENUE FRANCOIS VERDIER    
AGRIFRPP817;CREDIT AGRICOLE;LA ROCHELLE;LA ROCHELLE;Active;FRANCE;RUE LOUIS TARDY, 14    
AGRIFRPP907;CREDIT AGRICOLE;MER;CREDIT AGRICOLE TITRES;Active;FRANCE;4 AVENUE D'ALSACE    
AGRIGB2L;CREDIT AGRICOLE S.A. LONDON BRANCH;LONDON;LONDON;Active;United Kingdom;LONDON    
AGRILULA;CA INDOSUEZ WEALTH (EUROPE);LUXEMBOURG;LUXEMBOURG;Active;Luxembourg;LUXEMBOURG    
AGRIPLPR;CREDIT AGRICOLE BANK POLSKA S.A.;WROCLAW;WROCLAW;Active;POLAND;UL. LEGNICKA, 48 C-D    
AGRIRERX;CREDIT AGRICOLE;SAINT DENIS;SAINT DENIS;Active;REUNION;CITE DES LAURIERS LES CAMELIAS    
AHHBCH22;CREDIT SUISSE (SCHWEIZ) AG (FORMERLY NEUE AARGAUER BANK AG);AARAU;#N/A;Active;SWITZERLAND;#N/A
AIBKGB2L;ALLIED IRISH BANK (GB), AIB GROUP (UK) P.L.C.;LONDON;LONDON;Active;UNITED KINGDOM;OLD JEWRY 12   
AIBKGB2XTSY;ALLIED IRISH BANKS PLC;LONDON;GROUP TREASURY;Active;UNITED KINGDOM;GROUP TREASURY    
AIBKIE2D;AIB BANK;DUBLIN;DUBLIN;Active;IRELAND;MOLESWORTH STREET, 10 AIB   
AIBKUS3TTMK;AIB BANK;NEW YORK;TREASURY DEPT;Active;United States;TREASURY DEPT    
AICHJPJN;AICHI BANK, LTD., THE;NAGOYA;NAGOYA;Active;JAPAN;SAKAE, 14-12   3-CHOME NAKA-KU 
AIGFUS33;AIG FINANCIAL PRODUCTS CORP.;WILTON;WILTON;Active;UNITED STATES OF AMERICA;DANBURY ROAD, 50   FLOOR 2 
AIGIUS33;AIG INTERNATIONAL INC.;WILTON;WILTON;Active;UNITED STATES OF AMERICA;DANBURY ROAD, 50    
AIGIUS3A;AIG INTERNATIONAL INC.;WILTON;WILTON;Active;United States;WILTON    
AIZKLV22;ABLV BANK, AS IN LIQUIDATION;RIGA;RIGA;Active;LATVIA;SKANSTES STREET , 7 BUILDING 1   
AJIBJOAX;ARAB JORDAN INVESTMENT BANK;AMMAN;AMMAN;Active;JORDAN;ZAHRAN STREET, 200 ARAB JORDAN INVESTMENT BANK TOWER   
AKBKDEFF;AKBANK AG;ESCHBORN;AKBANK;Active;Germany;AKBANK    
AKBKMTMT;AKBANK T.A.S. (MALTA BRANCH);ST. JULIAN'S;St Julians;Active;Malta;St Julians    
AKBKNL2R;AKBANK NV;AMSTERDAM;#N/A;Active;NETHERLANDS;#N/A
AKBKTRIS;AKBANK T.A.S.;ISTANBUL;ISTANBUL;Active;TURKEY;SABANCI CENTER LEVENT 4   
AKBKTRIS004;AKBANK T.A.S.;ISTANBUL;BAHCEKAPI BRANCH;Active;TURKEY;BUYUK POSTANE CADDESI, 47   EMINONU 
AKBPCHZZ;PRIVATBANK IHAG ZUERICH AG (FORMERLY AKB PRIVATBANK ZUERICH AG);ZURICH;#N/A;Active;SWITZERLAND;#N/A
AKROITMM;BANCA AKROS SPA;MILANO;MILANO;Active;Italy;MILANO    
ALBISARI;BANK AL BILAD;RIYADH;RIYADH;Active;SAUDI ARABIA;BANK AL BILAD SALAHUDDIN ROAD   
ALBLGB2L;ALPHA BANK LONDON LIMITED;LONDON;LONDON;Active;UNITED KINGDOM;KING WILLIAM STREET 85   
ALBPPLPW;ALIOR BANK SPOLKA AKCYJNA;WARSZAWA;WARSZAWA;Active;POLAND;LOPUSZANSKA, 38 D LOPUSZANSKA BUSINESS PARK   
ALBRZAJJ;ALBARAKA BANK;DURBAN;DURBAN;Active;SOUTH AFRICA;KINGSMEAD OFFICE PARK KINGSMEAD BOULEVARD  STALWART SIMELANE STREET 
ALECEGAL;UNION NATIONAL BANK-EGYPT S.A.E.;GIZA;GIZA;Active;EGYPT;GIZA
ALEIGB22;SANTANDER UK PLC (FORMERLY ALLIANCE AND LEICESTER PLC);LONDON;LONDON;Active;UNITED KINGDOM;TRITON SQUARE 2  REGENTS PLACE 
ALEIGB22TSY;SANTANDER UK PLC (FORMERLY ALLIANCE AND LEICESTER PLC);LONDON;GROUP TREASURY;Active;UNITED KINGDOM;GROUP TREASURY    
ALETITMM;BANCA ALETTI S.P.A.;MILANO;HEAD OFFICE;Active;Italy;HEAD OFFICE    
ALEXEGCX;BANK OF ALEXANDRIA S A E;CAIRO;CAIRO;Active;EGYPT;GOMHORIA STREET, 26    
ALEXEGCX002;BANK OF ALEXANDRIA S A E;PORT SAID;PORT SAID BRANCH;Active;EGYPT;GOMHOREA AND GABRTY    
ALFAKZKA;JSC ECO CENTER BANK (SB OF JSC BANK CENTERCREDIT);ALMATY;ALMATY;Active;KAZAKHSTAN;NURSULTAN NAZARBAYEV AVENUE 226    
ALFARUMM;ALFA-BANK;MOSCOW;MOSCOW;Active;Russian Federation;MOSCOW    
ALFAUAUK;JSC SENSE BANK;KYIV;KYIV;Active;Ukraine;KYIV    
ALFBTRIS;ALTERNATIFBANK A.S.;ISTANBUL;ISTANBUL;Active;TURKEY;CENDERE CADDESI, 109M 2D VADISTANBUL BULVAR AYAZAGA   
ALFHPKKA;BANK ALFALAH LIMITED;KARACHI;KARACHI;Active;PAKISTAN;B.A. BUILDING, FLOOR 1  I.I. CHUNDRIGAR ROAD 
ALFHPKKABBL;BANK ALFALAH LIMITED;LAHORE;#N/A;Active;PAKISTAN;#N/A
ALFHPKKAISL;BANK ALFALAH LIMITED;ISLAMABAD;#N/A;Active;PAKISTAN;#N/A
ALFHPKKAJBK;BANK ALFALAH LIMITED;KARACHI;#N/A;Active;PAKISTAN;#N/A
ALLAINBBBIF;INDIAN BANK(FORMERLY ALLAHABAD BANK);MUMBAI;INDUSTRIAL FINANCE BRANCH;Active;India;INDUSTRIAL FINANCE BRANCH    
ALLAINBBCIF;INDIAN BANK(FORMERLY ALLAHABAD BANK);KOLKATA;INDUSTRIAL FINANCE BRANCH;Active;India;INDUSTRIAL FINANCE BRANCH    
ALMBDKKK;ALM. BRAND BANK A/S;COPENHAGEN;#REF!;Active;DENMARK;MIDTERMOLEN 7    
ALMNKZKA;FIRST HEARTLAND JUSAN BANK JOINT-STOCK COMPANY;ALMATY;ALMATY;Active;KAZAKHSTAN;AL-FARABI AVENUE 36    
ALUBBHBM;ALUBAF ARAB INTERNATIONAL BANK B.S.C. (C);MANAMA;MANAMA;Active;BAHRAIN;854 ROAD, 3618 - ALUBAF TOWER - FLOOR 8 - BLOCK 436 - AL SEEF   
AMBPIT2M;VENETO BANCA S.P.A.;MONTEBELLUNA;#N/A;Active;ITALY;#N/A
AMMAGHAC;BANK OF AFRICA - GHANA LIMITED;ACCRA;ACCRA;Active;GHANA;FARRAR AVENUE, C 131/3 OFOSUA HOUSE  ADABRAKA 
AMMBMYKL;AMINVESTMENT BANK BERHAD (FORMERLY KNOWN AS AMMERCHANT BANK BERHAD);KUALA LUMPUR;KUALA LUMPUR;Active;MALAYSIA;JALAN RAJA CHULAN 55  BANGUNAN AMBANK GROUP FLOOR 22
AMPCAU2S;BNP PARIBAS FUND SERVICES AUSTRALASIA PTY LIMITED;SYDNEY;SYDNEY;Active;Australia;SYDNEY    
ANBIAGAG;ABI BANK LTD.;ST. JOHN'S;#N/A;Active;ANTIGUA AND BARBUDA;#N/A
ANDLNL2A;ANADOLUBANK NEDERLAND N.V.;AMSTERDAM;AMSTERDAM;Active;NETHERLANDS;DE BOELELAAN , 7 GEBOUW   OFFICIA 1
ANDLTRIS;ANADOLUBANK A.S.;ISTANBUL;ISTANBUL;Active;TURKEY;ANADOLUBANK GENEL MUDURLUK SARAY MAHALLESI , TOYA SOKAK 3  UMRANIYE 
ANGOIE2D;IRISH BANK RESOLUTION CORPORATION LIMITED (IN SPECIAL LIQUIDATION);DUBLIN;DUBLIN;Active;IRELAND;DUBLIN
ANILJESH;SANTANDER FINANCIAL SERVICES PLC;ST. HELIER;ST. HELIER;Active;JERSEY;COMMERCIAL STREET, 19-21   FLOOR 3 
ANSLGB2L;ANSBACHER AND CO LIMITED;LONDON;#N/A;Active;UNITED KINGDOM;#N/A
ANTSGB2L;SANTANDER UK PLC (FORMERLY ABBEY NATIONAL TREASURY SERVICES PLC);LONDON;LONDON;Active;UNITED KINGDOM;TRITON SQUARE 2  ABBEY NATIONAL HOUSE 
ANYOUS31;AMALGAMATED BANK OF NEW YORK;NEW YORK;NEW YORK;Active;UNITED STATES OF AMERICA;UNION SQUARE,   11-15    
ANZBAU2S;AUSTRALIA AND NEW ZEALAND BANKING GROUP LIMITED;SYDNEY;Relationship Banking Northern;Active;AUSTRALIA;Relationship Banking Northern
ANZBAU3M;AUSTRALIA AND NEW ZEALAND BANKING GROUP LIMITED;MELBOURNE;MELBOURNE;Active;AUSTRALIA;QUEEN ST 100   
ANZBAU3MCLS;AUSTRALIA AND NEW ZEALAND BANKING GROUP LIMITED;MELBOURNE;MELBOURNE;Active;AUSTRALIA;COLLINS STREET 530   FLOOR 12
ANZBAU3MNOM;AUSTRALIA AND NEW ZEALAND BANKING GROUP LIMITED;MELBOURNE;CUSTODIAN SERVICES;Active;AUSTRALIA;ELIZABETH STREET 35   
ANZBAU41;AUSTRALIA AND NEW ZEALAND BANKING GROUP LIMITED;BRISBANE;BRISBANE;Active;AUSTRALIA;QUEEN STREET 324   
ANZBAU6P;AUSTRALIA AND NEW ZEALAND BANKING GROUP LIMITED;PERTH;#N/A;Active;AUSTRALIA;#N/A
ANZBCKCR;AUSTRALIA AND NEW ZEALAND BANKING GROUP LTD.;AVARUA;AVARUA;Active;COOK ISLANDS;AVARUA   ANZ HOUSE 
ANZBCNSH;AUSTRALIA AND NEW ZEALAND BANK (CHINA) COMPANY LIMITED;SHANGHAI;SHANGHAI;Active;China;SHANGHAI    
ANZBCNSHBJG;AUSTRALIA AND NEW ZEALAND BANKING GROUP LIMITED, BEIJING BRANCH;BEIJING;Beijing Branch;Active;CHINA;7 JIANGUOMENNEI AVENUE DONGCHENG DISTRICT  BRIGHT CHINA CHANG AN BUILDING TOWER 2, FLOOR 17
ANZBDEFF;AUSTRALIA AND NEW ZEALAND BANKING GROUP LIMITED NIEDERLASSUNG FRANKFURT AM MAIN;FRANKFURT AM MAIN;FRANKFURT AM MAIN;Active;Germany;FRANKFURT AM MAIN    
ANZBFJFX;AUSTRALIA AND NEW ZEALAND BANKING GROUP LIMITED;SUVA;SUVA;Active;FIJI;VICTORIA PARADE 25  CIVIC HOUSE FLOOR 4
ANZBGB2L;AUSTRALIA AND NEW ZEALAND BANKING GROUP LIMITED;LONDON;MAIN BRANCH;Active;UNITED KINGDOM;BANK STREET 40  CANARY WHARF 
ANZBHKHX;AUSTRALIA AND NEW ZEALAND BANKING GROUP LTD;CENTRAL;CENTRAL;Active;HONG KONG;CONNAUGHT PLACE, 8 EXCHANGE SQUARE, TOWER 1   SUITES 3101-05
ANZBHKHXAAL;AUSTRALIA AND NEW ZEALAND BANKING GROUP LTD;CENTRAL;CENTRAL;Active;HONG KONG;CONNAUGHT PLACE, 8 EXCHANGE SQUARE, TOWER 1   SUITES 3101-05
ANZBIDJX;BANK ANZ INDONESIA, P.T.;JAKARTA;ANZ PANIN KANTOR PUSAT;Active;Indonesia;ANZ PANIN KANTOR PUSAT    
ANZBINBX;AUSTRALIA AND NEW ZEALAND BANKING GROUP LIMITED;MUMBAI;RTGS-HO;Active;India;RTGS-HO    
ANZBJPJX;AUSTRALIA AND NEW ZEALAND BANKING GROUP LIMITED;CHIYODA;TOKYO;Active;JAPAN;MARUNOUCHI BUILDING FLOOR 33  4-1 MARUNOUCHI 2-CHOME CHIYODA-KU
ANZBKRSX;AUSTRALIA AND NEW ZEALAND BANKING GROUP LIMITED;SEOUL;SEOUL;Active;KOREA, REPUBLIC OF;KA CHONGRO 1, 1  KYOBO BUILDING FLOOR 18
ANZBNZ22;ANZ BANK NEW ZEALAND LIMITED;WELLINGTON;ANZ CORPORATE HEADQUARTERS;Active;New Zealand;ANZ CORPORATE HEADQUARTERS    
ANZBNZ22058;ANZ BANK NEW ZEALAND LIMITED;WELLINGTON;ANZ NZ HEADQUARTERS;Active;New Zealand;ANZ NZ HEADQUARTERS    
ANZBNZ22797;ANZ BANK NEW ZEALAND LIMITED;CHRISTCHURCH;CHRISTCHURCH;Active;New Zealand;CHRISTCHURCH    
ANZBNZ22NOM;ANZ NATIONAL BANK LIMITED (FORMERLY KNOWN AS: ANZ BANKING GROUP (NEW ZEALAND) LTD);WELLINGTON;#N/A;Active;NEW ZEALAND;#N/A
ANZBPGPX;AUSTRALIA AND NEW ZEALAND BANKING GROUP (PNG) LTD.;PORT MORESBY;PORT MORESBY;Active;PAPUA NEW GUINEA;DOUGLAS STREET   INVESMEN HAUS 
ANZBPHMX;AUSTRALIA AND NEW ZEALAND BANKING GROUP LIMITED;CITY OF MAKATI;CITY OF MAKATI;Active;PHILIPPINES;AYALA AVENUE 6767  MCC CENTRE FLOOR 9
ANZBSBSB;AUSTRALIA AND NEW ZEALAND BANKING GROUP LIMITED;HONIARA;HONIARA;Active;SOLOMON ISLANDS;MENDANA AVENUE    
