BIC_SWIFTCODE;INSTITUTIONNAME;CITYNAME;BRANCHINFO;STATUS;COUNTRYNAME;PHYSICALADDRESS
BRGFGB22LAC;SS AND C FUND SERVICES (UK) LTD;COBHAM;FUND ADMINISTRATION;Active;UNITED KINGDOM;FUND ADMINISTRATION    
BRGNKWKW;BURGAN BANK K.P.S.C;KUWAIT;SHARQ;Active;KUWAIT;ABDULLA AL AHMAD STREET, SAFA BURGAN TOWER   
BRGSBRRS;BANCO DO ESTADO DO RIO GRANDE DO SUL S/A;PORTO ALEGRE;PORTO ALEGRE;Active;BRAZIL;BANRISUL BUILDING FLOOR 7  RUA CALDAS JUNIOR 108 
BRINIDJA;PT. BANK RAKYAT INDONESIA (PERSERO), TBK;JAKARTA;JAKARTA;Active;INDONESIA;BRI I BUILDING FLOOR 18  44-46 JALAN JENDERAL SUDIRMAN 
BRLADE22;NORDDEUTSCHE LANDESBANK - GIROZENTRALE -;BREMEN;BREMEN;Active;Germany;BREMEN    
BRMIUS44;BRIDGESTONE AMERICAS, INC;NASHVILLE;NASHVILLE;Active;United States;NASHVILLE    
BROMITRD;UNICREDIT S.P.A. (FORMERLY UNICREDIT BANCA DI ROMA S.P.A.);ROMA;#N/A;Active;ITALY;#N/A
BROMITRDANX;UNICREDIT S.P.A. (FORMERLY UNICREDIT BANCA DI ROMA S.P.A.);ANCONA;#N/A;Active;ITALY;#N/A
BROMITRDBOX;UNICREDIT S.P.A. (FORMERLY UNICREDIT BANCA DI ROMA S.P.A.);BOLOGNA;#N/A;Active;ITALY;#N/A
BROMITRDFIX;UNICREDIT S.P.A. (FORMERLY UNICREDIT BANCA DI ROMA S.P.A.);FIRENZE;#N/A;Active;ITALY;#N/A
BROMITRDGEX;UNICREDIT S.P.A. (FORMERLY UNICREDIT BANCA DI ROMA S.P.A.);GENOVA;#N/A;Active;ITALY;#N/A
BROMITRDKEY;UNICREDIT BANCA DI ROMA S.P.A.;ROMA;#N/A;Active;ITALY;#N/A
BROMITRDMIX;UNICREDIT S.P.A. (FORMERLY UNICREDIT BANCA DI ROMA S.P.A.);MILANO;#N/A;Active;ITALY;#N/A
BROMITRDNAX;UNICREDIT S.P.A. (FORMERLY UNICREDIT BANCA DI ROMA S.P.A.);NAPOLI;#N/A;Active;ITALY;#N/A
BROMITRDVEX;UNICREDIT S.P.A. (FORMERLY UNICREDIT BANCA DI ROMA S.P.A.);VENEZIA;#N/A;Active;ITALY;#N/A
BROUUYMM;BANCO DE LA REPUBLICA ORIENTAL DEL URUGUAY;MONTEVIDEO;MONTEVIDEO;Active;URUGUAY;CERRITO, ZABALA STREET, 351    
BRRDDOSD;BANCO DE RESERVAS DE LA REPUBLICA DOMINICANA;SANTO DOMINGO;SANTO DOMINGO;Active;DOMINICAN REPUBLIC;TORRE BANRESERVAS AVENIDA WINSTON CHURCHILL  ESQUINA PORFIRIO HERRERA 
BRVICIA1;BOURSE REGIONALE DES VALEURS MOBILIERES;ABIDJAN;ABIDJAN;Active;COTE D'IVOIRE;18 RUE JOSEPH ANOMA    
BRWAQAQA;DUKHAN BANK (FORMERLY BARWA BANK);DOHA;DOHA;Active;Qatar;DOHA    
BSABESBB;BANCO DE SABADELL, S.A.;SANT CUGAT DEL VALLES;SABADELL, PL. CATALUNYA;Active;Spain;SABADELL, PL. CATALUNYA    
BSABFRPP;BANCO DE SABADELL;PARIS;PARIS;Active;FRANCE;7-11 BOULEVARD HAUSSMANN    
BSABGB2L;BANCO DE SABADELL S.A.;LONDON;LONDON;Active;UNITED KINGDOM;PALL MALL 120   
BSABUS3X;BANCO DE SABADELL, S.A.;MIAMI;MIAMI;Active;UNITED STATES OF AMERICA;BRICKELL AVENUE, 1111 SABADELL FINANCIAL CENTER   SUITE 30
BSAFBSNS;BANK J. SAFRA SARASIN (BAHAMAS) LTD.;NASSAU;NASSAU;Active;BAHAMAS;WESTERN ROAD LYFORD FINANCIAL CENTRE, BUILDING 2   
BSALSVSS;BANCO DAVIVIENDA SALVADORENO SA;SAN SALVADOR;SAN SALVADOR;Active;EL SALVADOR;AV. OLIMPICA, 3550 CENTRO FINANCIERO  FLOOR 4 
BSAMLKLX;SAMPATH BANK PLC;COLOMBO;COLOMBO;Active;SRI LANKA;SIR JAMES PEIRIS MAWATHA, 110 SAMPATH CENTRE   2 COLOMBO
BSARLBBX;AUDI PRIVATE BANK S.A.L.;BEIRUT;BEIRUT;Active;Lebanon;BEIRUT    
BSAVFR2C;BANQUE DE SAVOIE S.A.;CHAMBERY;HEAD OFFICE;Active;France;HEAD OFFICE    
BSBMMGMG;BANQUE SBM MADAGASCAR;ANTANANARIVO;Antsahavola;Active;Madagascar;Antsahavola    
BSCHBEBB;SANTANDER CONSUMER FINANCE, S.A.;BRUSSELS;BRUSSELS;Active;BELGIUM;AVENUE DES NERVIENS 85    
BSCHBRSP;BANCO SANTANDER (BRASIL) S.A.;SAO PAULO;HEAD OFFICE;Active;BRAZIL;VILA OLIMPIA E 2235 - BLOCO A  AVENIDA PRESIDENTE JUSCELINO K 2041 
BSCHBRSPSEC;BANCO SANTANDER (BRASIL) S.A.;SAO PAULO;SECURITIES DEPARTMENT;Active;BRAZIL;RUA FUNCHAL 160    
BSCHCLRM;BANCO SANTANDER CHILE;SANTIAGO;SANTIAGO;Active;CHILE;BANDERA , 140    
BSCHCOBB;ITAU SECURITIES SERVICES COLOMBIA S.A. SOCIEDAD FIDUCIARIA;BOGOTA;BOGOTA;Active;Colombia;BOGOTA    
BSCHCOBBBO1;ITAU SECURITIES SERVICES COLOMBIA S.A. SOCIEDAD FIDUCIARIA;BOGOTA;BOGOTA;Active;COLOMBIA;EDIFICIO BAVARIA TORRE A FLOOR 13  CARRERA 10 28-49 
BSCHDEFF;BANCO SANTANDER S.A.;FRANKFURT AM MAIN;Banco Santander Ffm;Active;Germany;Banco Santander Ffm    
BSCHESMM;BANCO SANTANDER S.A.;MADRID;ALL SPAIN BRANCHES;Active;Spain;ALL SPAIN BRANCHES    
BSCHESMMCLS;BANCO SANTANDER S.A.;MADRID;SANTANDER MADRID CLS CONTROL BRANCH;Active;SPAIN;SANTANDER MADRID CLS CONTROL BRANCH    
BSCHFRPP;BANCO SANTANDER S.A.;PARIS;AG CENTRALE;Active;France;AG CENTRALE    
BSCHGB2L;BANCO SANTANDER S.A.;LONDON;LONDON;Active;UNITED KINGDOM;REGENTS PLACE 2  TRITON SQUARE 
BSCHHKHH;BANCO SANTANDER, S.A. HONG KONG BRANCH (A PUBLIC LTD LIABILITY CO INCORPORATED IN SPAIN);CENTRAL;(HEAD OFFICE IN HONG KONG);Active;HONG KONG;FINANCE STREET, 8 TWO INTERNATIONAL FINANCE CENTRE  FLOOR 10 SUITE 1001
BSCHKYKX;BANCO SANTANDER (BRASIL) SA GRAND CAYMAN BRANCH;GEORGETOWN;GEORGETOWN;Active;CAYMAN ISLANDS;NORTH ST, 28 WATERFRONT CENTRE BUILDING  FLOOR 2 
BSCHUS33;BANCO SANTANDER S.A. NEW YORK;NEW YORK;NEW YORK BRANCH;Active;UNITED STATES OF AMERICA;EAST 53RD STREET, 45    
BSCHVECA;BANCO DE VENEZUELA, S.A. BANCO UNIVERSAL;CARACAS;#N/A;Active;VENEZUELA;#N/A
BSCLCLRM;BANCO SECURITY;SANTIAGO;SANTIAGO;Active;CHILE;AGUSTINAS , 621    
BSCOGB2L;BROWN,SHIPLEY AND CO. LTD.;LONDON;LONDON;Active;UNITED KINGDOM;FOUNDERS COURT    
BSCTCH22;BANCA DELLO STATO DEL CANTONE TICINO;BELLINZONA;BELLINZONA;Active;Switzerland;BELLINZONA    
BSDTGB2X;THE BANK OF NEW YORK MELLON;LONDON;LONDON;Active;United Kingdom;LONDON    
BSDTUS33;THE BANK OF NEW YORK MELLON;EVERETT;EVERETT,MA;Active;United States;EVERETT,MA    
BSDTUS33CLS;THE BANK OF NEW YORK MELLON;PITTSBURGH;PITTSBURGH,PA;Active;United States;PITTSBURGH,PA    
BSDTUS33GBL;THE BANK OF NEW YORK MELLON;EVERETT;GLOBAL CUSTODY;Active;United States;GLOBAL CUSTODY    
BSFRSARI;BANQUE SAUDI FRANSI;RIYADH;RIYADH;Active;SAUDI ARABIA;AL-MA'THER STREET    
BSFRSARIGEM;BANQUE SAUDI FRANSI;RIYADH;HEAD OFFICE;Active;SAUDI ARABIA;AL-MAATHER FLOOR GF   
BSFRSARIWST;BANQUE SAUDI FRANSI;JEDDAH;WESTERN REGION;Active;SAUDI ARABIA;TOWER BUILDING MEDINA ROAD   
BSHLHKHH;MACQUARIE CAPITAL LIMITED;CENTRAL;HONG KONG;Active;HONG KONG;INTERNATIONAL FINANCE CENTRE FLOOR 22-23  1 HARBOUR VIEW STREET CENTRAL 
BSHROMRU;SOHAR INTERNATIONAL BANK S.A.O.G;MUSCAT;MUSCAT;Active;OMAN;WATER FRONT BUILDING 166 FLOOR 4  AL SHATTI BEACH HAI AL MINA
BSICITRR;UNICREDIT S.P.A. (FORMERLY BANCO DI SICILIA S.P.A.;PALERMO;#N/A;Active;ITALY;#N/A
BSICITRRMES;UNICREDIT S.P.A. (FORMERLY BANCO DI SICILIA S.P.A.;MESSINA;#N/A;Active;ITALY;#N/A
BSICITRRMI1;UNICREDIT S.P.A. (FORMERLY BANCO DI SICILIA S.P.A.;MILANO;#N/A;Active;ITALY;#N/A
BSICITRRPA1;UNICREDIT S.P.A. (FORMERLY BANCO DI SICILIA S.P.A.;PALERMO;#N/A;Active;ITALY;#N/A
BSICITRRRGS;UNICREDIT S.P.A. (FORMERLY BANCO DI SICILIA S.P.A.;RAGUSA;#N/A;Active;ITALY;#N/A
BSICITRRRM1;UNICREDIT S.P.A. (FORMERLY BANCO DI SICILIA S.P.A.;PALERMO;#N/A;Active;ITALY;#N/A
BSICITRRRM3;UNICREDIT S.P.A. (FORMERLY BANCO DI SICILIA S.P.A.;PALERMO;#N/A;Active;ITALY;#N/A
BSICITRRTO1;UNICREDIT S.P.A. (FORMERLY BANCO DI SICILIA S.P.A.;TORINO;#N/A;Active;ITALY;#N/A
BSILCH22;EFG BANK SA, LUGANO BRANCH;LUGANO;(HEAD OFFICE);Active;Switzerland;(HEAD OFFICE)    
BSILCH2212A;EFG BANK SA, LUGANO BRANCH;GENEVA;GENEVA;Active;Switzerland;GENEVA    
BSIOBSNX;BSI OVERSEAS (BAHAMAS) LIMITED;NASSAU;NASSAU;Active;BAHAMAS;NASSAU
BSIRAEAD;BANK SADERAT IRAN;DUBAI;#N/A;Active;UNITED ARAB EMIRATES;#N/A
BSIRIRTH;BANK SADERAT IRAN;TEHRAN;#N/A;Active;IRAN, ISLAMIC REPUBLIC OF;#N/A
BSMXMXMM;BANCO S3 CACEIS MEXICO, S.A., INSTITUCION DE BANCA MULTIPLE;CIUDAD DE MEXICO;CIUDAD DE MEXICO;Active;MEXICO;VASCO DE QUIROGA, 3900 TORRE DIAMANTE  FLOOR 20 
BSNJCRSJ;BANCO BAC SAN JOSE;SAN JOSE;SAN JOSE;Active;COSTA RICA;0 AV.  CALLE, 3 Y 5    
BSPFFRPP;BANQUE PALATINE;FONTENAY-SOUS-BOIS;FONTENAY SOUS BOIS;Active;France;FONTENAY SOUS BOIS    
BSPLGB2L;BANK SADERAT PLC;LONDON;#N/A;Active;UNITED KINGDOM;#N/A
BSPOTHB1;BUALUANG SECURITIES PUBLIC COMPANY LIMITED;BANGKOK;BANGKOK;Active;THAILAND;SILOM COMPLEX OFFICE BUILDING FLOOR 29  191 SILOM ROAD BANGRAK
BSSACHGG;CBH COMPAGNIE BANCAIRE HELVETIQUE SA;GENEVA;GENEVA;Active;Switzerland;GENEVA    
BSSSESM2;CACEIS BANK SPAIN SAU;POZUELO;POZUELO;Active;SPAIN;PARQUE EMPRESARIAL LA FINCA PASEO CLUB DEPORTIVO 1   
BSTUTNTT;ATTIJARI BANK;TUNIS;TUNIS;Active;TUNISIA;AVENUE DE LA LIBERTE, 95    
BSTUTNTTINT;ATTIJARI BANK;TUNIS;INTERNATIONAL DEPARTMENT;Active;Tunisia;INTERNATIONAL DEPARTMENT    
BSUDARBA;BANCO PATAGONIA S.A.;BUENOS AIRES;BUENOS AIRES;Active;ARGENTINA;AV. DE MAYO, 701 EDIFICIO PATAGONIA   
BSUDCOBB;BANCO GNB SUDAMERIS;BOGOTA;BOGOTA;Active;COLOMBIA;CARRERA 8, 15-42   FLOOR 3 
BSUDPEPL;SCOTIABANK PERU S.A.A.;LIMA;LIMA;Active;PERU;AV. CANAVAL Y MOREYRA 522 CRUCE CON REP. PANAMA - SAN ISIDRO   
BSUIAEAD;CREDIT AGRICOLE CIB (DUBAI BRANCH);DUBAI;DUBAI;Active;UNITED ARAB EMIRATES;MAZE TOWER FLOOR 14  SHEIKH ZAYED ROAD 
BSUIDZAL;CREDIT AGRICOLE CORPORATE AND INVESTMENT BANK ALGERIE, SPA;ALGIERS;ALGIERS;Active;ALGERIA;IMMEUBLE ALGER BUSINESS CENTE    
BSUIESMM;CREDIT AGRICOLE CIB;MADRID;MADRID;Active;Spain;MADRID    
BSUIFIHH;CREDIT AGRICOLE CIB;HELSINKI;HELSINKI;Active;FINLAND;UNIONINKATU 32B    
BSUIFRPP;CREDIT AGRICOLE CIB;MONTROUGE;AG COURBEVOIE;Active;France;AG COURBEVOIE    
BSUIITMM;CREDIT AGRICOLE CIB;MILANO;MILANO;Active;Italy;MILANO    
BSUIJPJT;CREDIT AGRICOLE CIB TOKYO BRANCH;MINATO;TOKYO;Active;JAPAN;1-9-2 HIGASHI SHIMBASHI, MINATO-KU    
BSUILULL;CACEIS BANK, LUXEMBOURG BRANCH;LUXEMBOURG;LUXEMBOURG;Active;Luxembourg;LUXEMBOURG    
BSUISESS;CREDIT AGRICOLE CIB SWEDEN BRANCH;STOCKHOLM;STOCKHOLM;Active;Sweden;STOCKHOLM    
BSUIZAJJ;CREDIT AGRICOLE CIB SOUTH AFRICA BRANCH;MELROSE ARCH;#N/A;Active;SOUTH AFRICA;#N/A
BSUPARBA;BANCO SUPERVIELLE;BUENOS AIRES;BUENOS AIRES;Active;ARGENTINA;BARTOLOME MITRE, 434    
BSUPARBAFIN;BANCO SUPERVIELLE;BUENOS AIRES;DTO. OPERACIONES DE MERCADO;Active;ARGENTINA;DTO. OPERACIONES DE MERCADO    
BTBKTNTT;BANQUE DE TUNISIE;TUNIS;TUNIS;Active;TUNISIA;RUE DE TURQ, 2 UIE    
BTCDUS44;BANKERS TRUST COMPANY;DES MOINES;DES MOINES;Active;UNITED STATES OF AMERICA;7TH STREET, 453    
BTCITGTG;INTERNATIONAL BUSINESS BANK TOGO;LOME;LOME;Active;Togo;LOME    
BTFHTRIS;ALBARAKA TURK PARTICIPATION BANK;ISTANBUL;ISTANBUL;Active;TURKEY;HEADQUARTER FLOOR 8  SARAY MAHALLESI DR.ADNAN BUYUKDENIZ CADDESI NO:6 UMRANIYE
BTONTONU;WESTPAC BANK OF TONGA;NUKU'ALOFA;#N/A;Active;TONGA;#N/A
BTRLRO22;BANCA TRANSILVANIA S.A.;CLUJ-NAPOCA;CLUJ-NAPOCA;Active;ROMANIA;CALEA DOROBANTILOR, 30-36    
BTVAAT22;BANK FUER TIROL UND VORARLBERG AG;INNSBRUCK;INNSBRUCK;Active;AUSTRIA;Stadtforum 1    
BUCUROBU;ALPHA BANK ROMANIA SA;BUCHAREST;BUCURESTI;Active;ROMANIA;DOROBANTILOR STREET 237B 1ST DISTRICT   
BUDAHUHB;MBH BANK NYRT.;BUDAPEST;BUDAPEST;Active;HUNGARY;VACI UT. , 193    
BUIBBGSF;UNITED BULGARIAN BANK AD (FORMERLY CIBANK JSC);SOFIA;#N/A;Active;BULGARIA;#N/A
BUINBGSF;ALLIANZ BANK BULGARIA AD;SOFIA;SOFIA;Active;BULGARIA;PARK LANE OFFICE CENTER FLOOR 6  SREBARNA 16 
BUKBGB22;BARCLAYS BANK UK PLC;LONDON;LONDON;Active;UNITED KINGDOM;CHURCHILL PLACE 1   
BUTRPHM1;BUREAU OF THE TREASURY;CITY OF MANILA;CITY OF MANILA;Active;PHILIPPINES;PALACIO DEL GOBERNADOR INTRAMUROS   
BVBEHKHH;UNICREDIT BANK AG HONG KONG BRANCH INCORPORATED   IN GERMANY WITH LIMITED LIABILITY;CENTRAL;CENTRAL;Active;HONG KONG;68 DES VOEUX ROAD CENTRAL MAN YEE BUILDING  FLOOR 26 
BVBEJPJT;UNICREDIT BANK AG TOKYO BRANCH (HYPOVEREINSBANK TOKYO BRANCH);TOKYO;TOKYO;Active;JAPAN;TEKKO BUILDING FLOOR 4  1-8-2 MARUNOUCHI, CHIYODA-KU 
BVBESGSG;UNICREDIT BANK AG SINGAPORE BRANCH (HYPOVEREINSBANK AG SINGAPORE BRANCH);SINGAPORE;SINGAPORE;Active;SINGAPORE;RAFFLES QUAY, 1 NORTH TOWER  36 01
BWEUPLPW;MERITUM BANK ICB S.A.;GDANSK;#N/A;Active;POLAND;#N/A
BWLINANX;BANK WINDHOEK LIMITED;WINDHOEK;WINDHOEK;Active;NAMIBIA;INDEPENDENCE AVENUE 262   
BWSTUS66;BMO HARRIS BANK N.A. (FORMERLY BANK OF THE WEST);CHICAGO;Walnut Creek;Active;United States;Walnut Creek    
BXBACRSJ;BANCO DAVIVIENDA (COSTA RICA), S.A.;SAN RAFAEL;SAN RAFAEL;Active;COSTA RICA;MERIDIANO (TORRE DAVIVIENDA) FLOOR 9   ESCAZU  GUACHIPELIN
BYBALBBX;BYBLOS BANK S.A.L.;BEIRUT;BEIRUT;Active;Lebanon;BEIRUT    
BYBBBEBB;BYBLOS BANK EUROPE S.A.;BRUSSELS;BRUSSELS;Active;Belgium;BRUSSELS    
BYBBGB2L;BYBLOS BANK EUROPE S.A. (LONDON BRANCH);LONDON;LONDON;Active;UNITED KINGDOM;BERKELEY SQUARE   BERKELEY SQUARE HOUSE FLOOR 8
BYLADEM1FFB;SPARKASSE FUERSTENFELDBRUCK;FUERSTENFELDBRUCK;Spk Fuerstenfeldbruck;Active;GERMANY;HAUPTSTRASSE 8    
BYLADEM1MDF;SPARKASSE ALTOETTING-MUEHLDORF;MUEHLDORF AM INN;MUEHLDORF;Active;GERMANY;MUEHLDORF    
BYLADEMM;BAYERISCHE LANDESBANK, MUENCHEN;MUENCHEN;BayernLB Muenchen;Active;Germany;BayernLB Muenchen    
BYLADEMMCLS;BAYERISCHE LANDESBANK, MUENCHEN;MUENCHEN;CLS OPERATIONS;Active;GERMANY;BRIENNER STRASSE 18    
BYLAGB22;BAYERISCHE LANDESBANK;LONDON;LONDON;Active;UNITED KINGDOM;LONDON WALL 120  MOORE HOUSE 
BYLAHKHH;BAYERISCHE LANDESBANK;HONG KONG;#N/A;Active;HONG KONG;#N/A
BYLAUS33;BAYERISCHE LANDESBANK;NEW YORK;NEW YORK;Active;United States;NEW YORK    
BYLAUS33NYC;BAYERISCHE LANDESBANK;NEW YORK;NEW YORK;Active;United States;NEW YORK    
BZWSSGS1;BARCLAYS CAPITAL FUTURES (SINGAPORE) PRIVATE LIMITED;SINGAPORE;SINGAPORE;Active;Singapore;SINGAPORE    
CAABJOAM;CAIRO AMMAN BANK;AMMAN;AMMAN;Active;JORDAN;WADI SAQRA STREET CAIRO AMMAN BANK BUILDING   
CABILULL;UBI BANCA INTERNATIONAL S.A.;LUXEMBOURG;#N/A;Active;LUXEMBOURG;#N/A
CABLZAJJ;CAPITEC BANK LIMITED;STELLENBOSCH;STELLENBOSCH;Active;SOUTH AFRICA;IKHAYA FLOOR 5  5 NEUTRON ROAD 
CABSZWHA;CENTRAL AFRICA BUILDING SOCIETY;HARARE;HARARE;Active;ZIMBABWE;NORTHEND CLOSE NORTHRIDGE PARK HIGHLANDS   
CADKSNDA;LA BANQUE AGRICOLE;DAKAR;DAKAR;Active;SENEGAL;RUE AMADOU ASSANE NDOYE X COL PLACE DE L'INDEPENDANCE, 31-33 -   
CAETAU21;ASX SETTLEMENT AND TRANSFER CORPORATION PTY LIMITED;SYDNEY;SYDNEY;Active;AUSTRALIA;20 BRIDGE STREET FLOOR 5   
CAFCVECA;CORPORACION ANDINA DE FOMENTO;SANTIAGO DE LEON DE CARACAS;SANTIAGO DE LEON DE CARACAS;Active;VENEZUELA (BOLIVARIAN REPUBLIC OF);AVENIDA LUIS ROCHE TORRE CENTRAL  FLOOR 7 ALTAMIRA
CAFEUS3M;BANCO DAVIVIENDA S.A.;MIAMI;MIAMI;Active;UNITED STATES OF AMERICA;BRICKELL AVENUE PH 1, 801    
CAFGMAMC;CFG BANK;CASABLANCA;CASABLANCA;Active;Morocco;CASABLANCA    
CAGRSVSS;BANCO AGRICOLA, S.A.;SAN SALVADOR;SAN SALVADOR;Active;EL SALVADOR;FINAL BOULEVARD CONSTITUCION, 100    
CAHMESMM;CAIXABANK, S.A. (PREVIOUSLY BANKIA S.A.);VALENCIA;VALENCIA;Active;SPAIN;PINTOR SOROLLA 8    
CAIBATWW;UNICREDIT BANK AG;VIENNA;, ZWEIGNIEDERLASSUNG WIEN;Active;Austria;, ZWEIGNIEDERLASSUNG WIEN    
CAIXESBB;CAIXABANK, S.A.;BARCELONA;MAIN BRANCH;Active;Spain;MAIN BRANCH    
CAKXLUL1;STONEX FINANCIAL EUROPE, S.A.;LUXEMBOURG;LUXEMBOURG;Active;Luxembourg;LUXEMBOURG    
CALBUS66;ZB, NA,(FORMERLY CALIFORNIA BANK AND TRUST);LOS ANGELES,CA;#N/A;Active;UNITED STATES;#N/A
CAMBITRR;BANCA D'ITALIA;ROMA;ROMA;Active;Italy;ROMA    
CANFUS33;CANTOR FITZGERALD AND CO.;NEW YORK;NEW YORK;Active;United States;NEW YORK    
CAPDDK22;CAPINORDIC BANK A/S;HELLERUP;#N/A;Active;DENMARK;#N/A
CAPLBWGA;CAPITAL BANK LIMITED;GABORONE;#N/A;Active;BOTSWANA;#N/A
CARBVECA;BANCO DEL CARIBE C.A. BANCO UNIVERSAL;SANTIAGO DE LEON DE CARACAS;SANTIAGO DE LEON DE CARACAS;Active;VENEZUELA (BOLIVARIAN REPUBLIC OF);DOCTOR PAUL A SALVADOR DE LEON EDIFICIO BANCO DEL CARIBE   
CARNLULL;BANQUE CARNEGIE LUXEMBOURG S.A.;LUXEMBOURG;LUXEMBOURG;Active;Luxembourg;LUXEMBOURG    
CASPKZKA;KASPI BANK JSC;ALMATY;ALMATY;Active;KAZAKHSTAN;NAURYZBAI BATYR STREET 154A    
CASRIT22;CASSA DI RISPARMIO DI ASTI SPA;ASTI;ASTI;Active;Italy;ASTI    
CAVIES2V;CAIXANOVA (CAIXAVIGO, OURENSE E PONTEVEDRA);VIGO;#N/A;Active;SPAIN;#N/A
CAVLARBA;CAJA DE VALORES S.A.;BUENOS AIRES;BUENOS AIRES;Active;Argentina;BUENOS AIRES    
CAYTTRIS;AKTIF YATIRIM BANKASI A.S.;ISTANBUL;ISTANBUL;Active;TURKEY;AKTIFBAN GENEL MUDURLUK BUYUKDERE CAD. 163  ZINCIRLIKUYU/SISLI 
CAZEGB2L;J.P. MORGAN CAZENOVE LIMITED;LONDON;#N/A;Active;UNITED KINGDOM;#N/A
CAZRES2Z;IBERCAJA BANCO S A;ZARAGOZA;HEAD OFFICE;Active;Spain;HEAD OFFICE    
CBAFKENX;NCBA BANK KENYA PLC;NAIROBI;NAIROBI;Active;KENYA;MARA AND RAGATI ROAD NCBA CENTRE  UPPER HILL 
CBAFUGKA;NCBA BANK UGANDA LIMITED;KAMPALA;KAMPALA;Active;UGANDA;PLOT 10 KAFU ROAD NAKASERO    
CBAOBFBG;CBAO GROUPE ATTIJARIWAFA BANK BURKINA FASO;OUAGADOUGOU;OUAGADOUGOU;Active;Burkina Faso;OUAGADOUGOU    
CBAOSNDA;COMPAGNIE BANCAIRE DE L'AFRIQUE OCCIDENTALE;DAKAR;DAKAR;Active;SENEGAL;PLACE DE L'INDEPENDANCE, 1    
CBAUAEAA;CENTRAL BANK OF THE U.A.E.;ABU DHABI;ABU DHABI;Active;UNITED ARAB EMIRATES;NEXT TO - KING ABDULLAH BIN ABDULAZ AL SAUD ST - AL BATEENW, 34  - 
CBBABRSP;ITAU UNIBANCO S/A;SAO PAULO;SAO PAULO;Active;BRAZIL;AVENIDA BRIGADEIRO FARIA LIMA 3400   FLOOR 3-8
CBBABSNS;ITAU UNIBANCO S.A. - NASSAU BRANCH (FORMERLY BANCO ITAU BBA S.A. - NASSAU BRANCH);NASSAU;NASSAU;Active;BAHAMAS;EAST BAY STREET, 31B ANNEX BUILDING  FLOOR 2 
CBBABSNSBNF;ITAU UNIBANCO S.A. - NASSAU BRANCH (FORMERLY BANCO ITAU BBA S.A. - NASSAU BRANCH);NASSAU;CASH CUSTOMERS TRANFS;Active;BAHAMAS;EAST BAY STREET, 31B ANNEX BUILDING  FLOOR 2 
CBCDCMCX;COMMERCIAL BANK OF CAMEROON;DOUALA;DOUALA;Active;Cameroon;DOUALA    
CBCELKLX;CENTRAL BANK OF SRI LANKA;COLOMBO;COLOMBO;Active;SRI LANKA;JANADHIPATHI MAWATHA, 30    
CBCTTWTP;CENTRAL BANK OF CHINA TAIPEI;TAIPEI CITY;TAIPEI CITY;Active;TAIWAN;2 ROOSEVELT ROAD FLOOR 3   
CBCUUYMM;BANCO CENTRAL DEL URUGUAY;MONTEVIDEO;MONTEVIDEO;Active;URUGUAY;FLORIDA   PAYSANDU 
CBCYCY2NFBU;CENTRAL BANK OF CYPRUS;NICOSIA;FOREIGN BUSINESS UNIT;Active;CYPRUS;FOREIGN BUSINESS UNIT    
CBDUAEAD;COMMERCIAL BANK OF DUBAI;DUBAI;DUBAI;Active;UNITED ARAB EMIRATES;AL ITTIHAD STREET    
CBEGEGCX;CENTRAL BANK OF EGYPT CAIRO;CAIRO;CAIRO;Active;EGYPT;EL-GOMHOREYA STREET, 54    
CBEGEGCXBKO;CENTRAL BANK OF EGYPT CAIRO;CAIRO;BACK OFFICE FOR DEALING ROOM;Active;EGYPT;EL-GOMHOREYA STREET, 54    
CBETETAA;COMMERCIAL BANK OF ETHIOPIA;ADDIS ABABA;ADDIS ABABA;Active;ETHIOPIA;CHURCHILL ROAD   WHITE BUILDING 
CBETETAATRY;COMMERCIAL BANK OF ETHIOPIA;ADDIS ABEBA;TREASURY DEPARTMENT;Active;ETHIOPIA;TREASURY DEPARTMENT    
CBETSSJB;COMMERCIAL BANK OF ETHIOPIA-SOUTHERN SUDAN LTD.;JUBA;JUBA;Active;South Sudan;JUBA    
CBGHGHAC;CONSOLIDATED BANK GHANA LIMITED;ACCRA;ACCRA;Active;GHANA;MANET TOWER 3 FLOOR 1   AIRPORT CITY
CBHKHKHH;PUBLIC BANK (HONG KONG) LIMITED;CENTRAL;CENTRAL;Active;HONG KONG;DES VOEUX ROAD, 120    
CBININBB;CENTRAL BANK OF INDIA;MUMBAI;INTERNATIONAL DIVISION;Active;India;INTERNATIONAL DIVISION    
CBININBBCAL;CENTRAL BANK OF INDIA;KOLKATA;(CALCUTTA MAIN OFFICE);Active;India;(CALCUTTA MAIN OFFICE)    
CBININBBPAR;CENTRAL BANK OF INDIA;DELHI;(PARLIAMENT STREET BRANCH);Active;India;(PARLIAMENT STREET BRANCH)    
CBJOJOAX;CENTRAL BANK OF JORDAN;AMMAN;AMMAN;Active;JORDAN;KING HUSSEIN STREET CENTRAL BANK OF JORDAN BUILDING   
CBKCUS44;COMMERCE BANK;KANSAS CITY;1000 Walnut St;Active;United States;1000 Walnut St    
CBKCUS44STL;COMMERCE BANK;ST. LOUIS;ST. LOUIS LOCATION;Active;United States;ST. LOUIS LOCATION    
CBKEKENX;CENTRAL BANK OF KENYA;NAIROBI;NAIROBI;Active;KENYA;HAILE SELASSIE AVENUE    
CBKEKENXBKG;CENTRAL BANK OF KENYA;NAIROBI;BANKING DIVISION;Active;KENYA;HAILE SELASSIE AVENUE    
CBKNNANX;BANK OF NAMIBIA;WINDHOEK;WINDHOEK;Active;NAMIBIA;ROBERT MUGABE AVENUE 71   
CBKUKWKW;CENTRAL BANK OF KUWAIT;KUWAIT;SHARQ;Active;KUWAIT;ABDULLAH AL-AHMAD STREET    
CBKUKWKWBOD;CENTRAL BANK OF KUWAIT;KUWAIT;BANKING OPERATIONS DEPARTMENT - KWD ONLY;Active;Kuwait;BANKING OPERATIONS DEPARTMENT - KWD ONLY    
CBLELSMX;CENTRAL BANK OF LESOTHO;MASERU;MASERU;Active;LESOTHO;MOSHOESHOE AND AIRPORT ROADS    
CBLJLYLX;CENTRAL BANK OF LIBYA;TRIPOLI;TRIPOLI;Active;LIBYA;AL FATAH STREET    
CBLJLYLY;CENTRAL BANK OF LIBYA;TRIPOLI;TRIPOLI;Active;LIBYA;CENTRAL BANK OF LIBYA (HQ) AL FATAH STREET   
CBLUCH22;CORNER BANCA S.A.;LUGANO;HEAD OFFICE;Active;Switzerland;HEAD OFFICE    
CBLULULX;CORNER BANQUE (LUXEMBOURG) S.A.;LUXEMBOURG;#N/A;Active;LUXEMBOURG;#N/A
CBNAUS33;TD BANK, N.A.(FORMERLY COMMERCE BANK N.A.);MOUNT LAUREL,NJ;#N/A;Active;UNITED STATES;#N/A
CBNINGLA;CENTRAL BANK OF NIGERIA;LAGOS;LAGOS;Active;NIGERIA;TIMURE SQUARE    
CBORETAA;COOPERATIVE BANK OF OROMIA S.C.;ADDIS ABABA;ADDIS ABABA;Active;ETHIOPIA;AFRICA AVENUE   GET HOUSE BUILDING 
CBPBUS6L;COMMUNITY BANK;PASADENA,CA;PASADENA,CA;Active;United States;PASADENA,CA    
CBQAQAQA;THE COMMERCIAL BANK (P.S.Q.C.);DOHA;DOHA;Active;Qatar;DOHA    
CBRAAM22;CENTRAL BANK OF ARMENIA;YEREVAN;YEREVAN;Active;ARMENIA;VAZGEN SARGSYAN STREET 6   
CBRFRUMM;CENTRAL BANK OF RUSSIAN FEDERATION;MOSCOW;OPERATIONAL DEPARTMENT;Active;Russian Federation;OPERATIONAL DEPARTMENT    
CBSWCHZZ;CITIBANK (SWITZERLAND) AG;ZUERICH;ZURICH;Active;Switzerland;ZURICH    
CBUZUZ22;CENTRAL BANK OF THE REPUBLIC UZBEKISTAN;TASHKENT;TASHKENT;Active;UZBEKISTAN;ISLAM KARIMOV STREET , 6    
CBVILT2X;AB SEB BANKAS;VILNIUS;AB SEB bankas;Active;Lithuania;AB SEB bankas    
CBZAZAJJ;TYMEBANK;JOHANNESBURG;JOHANNESBURG;Active;SOUTH AFRICA;JELLICOE AVE, 30   FLOOR 2 
CCBCHKHH;CHANG HWA COMMERCIAL BANK LTD., HONG KONG BRANCH;TSIM SHA TSUI;TSIM SHA TSUI;Active;HONG KONG;CANTON ROAD, 25 GATEWAY BUILDING, TOWE II  FLOOR 14 
CCBCTWTP;CHANG HWA COMMERCIAL BANK LTD.;TAIPEI CITY;TAIPEI CITY;Active;TAIWAN;57 ZHONGSHAN NORTH ROAD ZHONGSHAN DIST.   
CCBCTWTP220;CHANG HWA COMMERCIAL BANK LTD.;TAICHUNG CITY;TAICHUNG - HEAD OFFICE;Active;TAIWAN;TAICHUNG - HEAD OFFICE    
CCBCTWTP410;CHANG HWA COMMERCIAL BANK LTD.;KEELUNG;KEELUNG BRANCH;Active;TAIWAN;60 AI 4TH RD., REN AI DIS. FLOOR 1   
CCBCTWTP523;CHANG HWA COMMERCIAL BANK LTD.;TAIPEI CITY;MIN SHENG BRANCH;Active;TAIWAN;746-1 MIN SHENG EAST ROAD    
CCBCTWTP526;CHANG HWA COMMERCIAL BANK LTD.;TAIPEI CITY;TAIPEI WORLD TRADE CENTER BRANCH;Active;TAIWAN;333 KEELUNG ROAD FLOOR 3   
CCBCTWTP640;CHANG HWA COMMERCIAL BANK LTD.;TAINAN CITY;TAINAN BRANCH;Active;TAIWAN;TAINAN BRANCH    
CCBCTWTP642;CHANG HWA COMMERCIAL BANK LTD.;;HSI-TAINAN BRANCH;Active;TAIWAN;HSI-TAINAN BRANCH    
CCBCTWTP811;CHANG HWA COMMERCIAL BANK LTD.;KAOHSIUNG;KAOHSIUNG BRANCH;Active;TAIWAN;KAOHSIUNG BRANCH    
CCBCTWTP814;CHANG HWA COMMERCIAL BANK LTD.;KAOHSIUNG;TUNG KAOHSIUNG BRANCH;Active;TAIWAN;TUNG KAOHSIUNG BRANCH    
CCBCUS33;CHANG HWA COMMERCIAL BANK, LTD., NEW YORK BRANCH;NEW YORK;NEW YORK;Active;UNITED STATES OF AMERICA;THIRD AVE., 685   FLOOR 29 
CCBKCY2N;HELLENIC BANK PUBLIC COMPANY LTD (FORMERLY CYPRUS COOPERATIVE BANK LTD);NICOSIA (LEFKOSIA);#N/A;Active;CYPRUS;#N/A
CCBPFRPP902;NATIXIS (FORMERLY NATEXIS BANQUES POPULAIRES);RUNGIS;#N/A;Active;FRANCE;#N/A
CCBPFRPP905;NATIXIS (FORMERLY NATEXIS BANQUES POPULAIRES);CERGY PONTOISE;#N/A;Active;FRANCE;#N/A
CCBPFRPP930;BANQUES POPULAIRES - BPCE GROUP;STRASBOURG;#N/A;Active;FRANCE;#N/A
CCBPFRPP931;BANQUES POPULAIRES - BPCE GROUP;TOULOUSE;#N/A;Active;FRANCE;#N/A
CCBPFRPPBDX;BANQUE POPULAIRE AQUITAINE CENTRE ATLANTIQUE;BORDEAUX;AG ENT 33 OUEST;Active;FRANCE;10 QUAI DE QUEYRIES    
CCBPFRPPMTG;BANQUE POPULAIRE RIVES DE PARIS;PARIS;AG ESS ET INSTIT;Active;FRANCE;76-78 AVENUE DE FRANCE    
CCBPFRPPNAN;BANQUE POPULAIRE GRAND OUEST;RENNES;AG YRIS ST HERBLAIN;Active;FRANCE;15 BOULEVARD DE LA BOUTIERE CS 2685    
CCBPFRPPNCE;BANQUE POPULAIRE MEDITERRANEE;NICE;NICE;Active;FRANCE;457 PROMENADE DES ANGLAIS    
CCBQHKAX;CHINA CONSTRUCTION BANK (ASIA) CORPORATION LIMITED;KOWLOON BAY;KOWLOON BAY;Active;HONG KONG;WANG CHIU ROAD, 18 CCB CENTRE   
CCDQCAMM;FEDERATION DES CAISSES DESJARDINS DU QUEBEC;LEVIS;HEAD OFFICE;Active;CANADA;RUE DES COMMANDEURS 100   
CCEICMCX;AFRILAND FIRST BANK;YAOUNDE;YAOUNDE;Active;Cameroon;YAOUNDE    
CCEYLKLX;COMMERCIAL BANK OF CEYLON PLC;COLOMBO;COLOMBO;Active;SRI LANKA;SIR RAZIK FAREED MAWATHA, 21 COMMERCIAL HOUSE   COLOMBO 1
CCFRFRPP;HSBC CONTINENTAL EUROPE;PARIS;AG SIEGE 434;Active;France;AG SIEGE 434    
CCICCNBJ;CHINA EXPORT AND CREDIT INSURANCE CORPORATION;BEIJING;BEIJING;Active;China;BEIJING    
CCIECHGG;HYPOSWISS PRIVATE BANK GENEVE SA;GENEVA;GENEVA;Active;Switzerland;GENEVA    
CCILINBB;CLEARING CORPORATION OF INDIA LTD, THE;MUMBAI;MUMBAI;Active;India;MUMBAI    
CCIOCRSJ;BANCO BCT S.A.;SAN JOSE;SAN JOSE;Active;COSTA RICA;1 KM OESTE DEL ESTADIO NACIONAL FRENTE A PLAZA MAYOR - EDIFICIO  CORPORATIVO BCT - 
CCOPFRPP;CREDIT COOPERATIF;NANTERRE;AG SIEGE;Active;France;AG SIEGE    
CCPLLULL;POST LUXEMBOURG;LUXEMBOURG;LUXEMBOURG;Active;Luxembourg;LUXEMBOURG    
CCRTIT2T;CASSA CENTRALE BANCA - CREDITO COOPERATIVO ITALIANO S.P.A.;TRENTO;TRENTO;Active;Italy;TRENTO    
CDBKUS44;CADENCE BANK;BIRMINGHAM;BIRMINGHAM;Active;UNITED STATES OF AMERICA;THIRD AVENUE NORTH, 2100    
CDCGFRPP;CAISSE DES DEPOTS ET CONSIGNATIONS;PARIS;AG SIEGE;Active;France;AG SIEGE    
CDCPPKK1;CENTRAL DEPOSITORY COMPANY OF PAKISTAN LIMITED;KARACHI;KARACHI;Active;PAKISTAN;KARACHI STOCK EXCHANGE BD FLOOR 8  STOCK EXCHANGE ROAD 
CDENESBB;CAIXA DE CREDIT DELS. ENGINYERS-CAJA DE CREDITO DE LOS INGENIEROS SOCIEDAD COOPERATIVA DE CREDIT;BARCELONA;BARCELONA;Active;Spain;BARCELONA    
CDIBTWTP;KGI BANK;TAIPEI CITY;TAIPEI CITY;Active;TAIWAN;135 DUNHUA N. ROAD FLOOR 9   
CDMAMAMC;CREDIT DU MAROC;CASABLANCA;ALL MOROCCO BRANCHES;Active;MOROCCO;BOULEVARD MOHAMMED V, 48-58    
CDPLSGSG;THE CENTRAL DEPOSITORY (PTE) LIMITED;SINGAPORE;SINGAPORE;Active;Singapore;SINGAPORE    
CDSCINB1;CENTRAL DEPOSITORY SERVICES (INDIA) LIMITED;MUMBAI;MUMBAI;Active;India;MUMBAI    
CDSLCATT;CDS CLEARING AND DEPOSITORY SERVICES INC.;TORONTO;TORONTO;Active;CANADA;ADELAIDE STREET WEST 100   
CECAESMM;CECABANK, S.A.;MADRID;MADRID;Active;Spain;MADRID    
CECAESMM098;MONTE DE PIEDAD Y CAJA DE AHORROS DE HUELVA Y SEVILLA;SEVILLA;#N/A;Active;SPAIN;#N/A
CECBBGSF;CENTRAL COOPERATIVE BANK PLC;SOFIA;SOFIA;Active;BULGARIA;CENTRAL COOPERATIVE BANK TSARIGRADSKO SHOSE BLVD. 87   
CEDELULL;CLEARSTREAM BANKING S.A., LUXEMBOURG;LUXEMBOURG;LUXEMBOURG;Active;Luxembourg;LUXEMBOURG    
CEDPBGS1;CENTRAL DEPOSITORY AD;SOFIA;#N/A;Active;BULGARIA;#N/A
CEDPBGSF;CENTRAL DEPOSITORY AD;SOFIA;SOFIA;Active;BULGARIA;TRI USHI STREET 6    
CEDTMUM1;CENTRAL DEPOSITORY AND SETTLEMENT CO. LTD;PORT LOUIS;PORT LOUIS;Active;Mauritius;PORT LOUIS    
CEDUKZKA;CENTRAL SECURITIES DEPOSITORY, JSC;ALMATY;ALMATY;Active;KAZAKHSTAN;MICRODISTRICT SAMAL-1 28    
CEKOCZPP;CESKOSLOVENSKA OBCHODNI BANKA, A.S.;PRAGUE;HEAD OFFICE;Active;CZECHIA;RADLICKA 333/150    
