BIC_SWIFTCODE;INSTITUTIONNAME;CITYNAME;BRANCHINFO;STATUS;COUNTRYNAME;PHYSICALADDRESS
FIDTNGLA;FIDELITY BANK PLC;LAGOS;LAGOS;Active;NIGERIA;KOFO ABAYOMI STREET, 2 FIDELITY PLACE   
FIIVBHBM;ARCAPITA;MANAMA;MANAMA;Active;BAHRAIN;BAHRAIN BAY ARCAPITA BUILDING  FLOOR 5 
FIMBMTM3;FIMBANK PLC;ST. JULIAN'S;St Julians;Active;Malta;St Julians    
FIMLGB2L;JPMORGAN ASSET MANAGEMENT (UK) LTD;LONDON;LONDON;Active;UNITED KINGDOM;VICTORIA EMBANKMENT 60   
FINAPEPL;BANCO PICHINCHA;LIMA;LIMA;Active;Peru;LIMA    
FIRBCHZZ;FIBI BANK (SWITZERLAND) LTD.;ZURICH;ZURICH;Active;SWITZERLAND;ZURICH
FIRBGB2L;FIBI BANK (UK) PLC;LONDON;#N/A;Active;UNITED KINGDOM;#N/A
FIRBILIT;FIRST INTERNATIONAL BANK OF ISRAEL LTD.,THE;TEL AVIV;TEL AVIV;Active;ISRAEL;ROTSCHILD BLVD., 42    
FIRNBWGX;FIRST NATIONAL BANK OF BOTSWANA LIMITED;GABORONE;GABORONE;Active;BOTSWANA;PLOT 8844 KHAMA CRESCENT FNB HOUSE  FLOOR 3 
FIRNGB2L;FIRSTRAND BANK LIMITED (LONDON BRANCH);LONDON;LONDON;Active;United Kingdom;LONDON    
FIRNGHAC;FIRST NATIONAL BANK GHANA LIMITED;ACCRA;ACCRA;Active;GHANA;INTERS INDEPENDENCE AV LIBERIA RD ACCRA FINANCIAL CENTRE  FLOOR 6 
FIRNINBB;FIRSTRAND BANK LIMITED;MUMBAI;RTGS-HO;Active;India;RTGS-HO    
FIRNLSMX;FIRST NATIONAL BANK OF LESOTHO;MASERU;MASERU;Active;LESOTHO;KINGSWAY   LNDC COMPLEX 
FIRNMZMX;FNB MOZAMBIQUE,SA;MAPUTO;MAPUTO;Active;MOZAMBIQUE;AVENUE 25 DE SEPTEMBRE 420  JAT FRONT OF FACIM FLOOR 1
FIRNNANX;FIRST NATIONAL BANK OF NAMIBIA LIMITED;WINDHOEK;WINDHOEK;Active;NAMIBIA;INDEPENDENCE AVENUE 209-211  FIRST NATIONAL BANK BUILDING FLOOR 3
FIRNNGLA;RAND MERCHANT BANK NIGERIA LIMITED;VICTORIA ISLAND;VICTORIA ISLAND;Active;NIGERIA;OZUMBA MBADIWE STREET, 17A WINGS TOWER  FLOOR 3 VICTORIA ISLAND
FIRNSZMX;FIRST NATIONAL BANK OF ESWATINI LIMITED;MBABANE;MBABANE;Active;ESWATINI;SWAZI PLAZA   SALES HOUSE BUILDING FLOOR 2
FIRNTZTX;FIRST NATIONAL BANK OF TANZANIA;DAR ES SALAAM;DAR ES SALAAM;Active;TANZANIA, UNITED REPUBLIC OF;FNB HOUSE FLOOR 2  OHIO ROAD 
FIRNZAJJ;FIRSTRAND BANK LIMITED;JOHANNESBURG;HEAD OFFICE AND ALL SOUTH AFRICAN OFFICES;Active;SOUTH AFRICA;4 MERCHANT PLACE CORNER FREDMAN DRIVE AND RIVONIA R   
FIRNZAJJ896;FIRSTRAND BANK LIMITED;JOHANNESBURG;CUSTODY SERVICES, INTERNATIONAL BANKING;Active;SOUTH AFRICA;3, FIRST PLACE, BANK CITY MEZZANINE FLOOR  CNR JEPPE AND SIMMONDS STREET 
FIRNZAJJCLS;FIRSTRAND BANK LIMITED;JOHANNESBURG;FIRSTRAND CLS;Active;SOUTH AFRICA;FIRST PLACE CORNER SIMMONDS AND PRITCHARD STREETS, 4 -   
FIRNZMLX;FIRST NATIONAL BANK ZAMBIA LIMITED;LUSAKA;LUSAKA;Active;ZAMBIA;CNR GREAT EAST ROAD, THABO MBEKI ROAD, STAND NUMBER 22768 - STAND  NUMBER 22768 - 
FISWZAJC;FINSWITCH (PTY) LTD;CAPE TOWN;#N/A;Active;SOUTH AFRICA;#N/A
FJIBCNBA;INDUSTRIAL BANK CO.,LTD.;FUZHOU;FUZHOU;Active;China;FUZHOU    
FJIBCNBA550;INDUSTRIAL BANK CO.,LTD.;NINGBO;NINGBO BRANCH;Active;CHINA;676 ZHONGXING ROAD    
FJIBCNBA777;INDUSTRIAL BANK CO.,LTD.;SHANGHAI;FINANCIAL MARKETS;Active;CHINA;FINANCIAL MARKETS    
FJIBCNBA900;INDUSTRIAL BANK CO.,LTD.;XI'AN;XI'AN BRANCH;Active;CHINA;XI'AN BRANCH    
FJIBHKHH;INDUSTRIAL BANK CO., LTD. HONG KONG BRANCH;CENTRAL;CENTRAL;Active;HONG KONG;GARDEN ROAD, 3 CITIBANK PLAZA, ICBC TOWER  FLOOR 39 
FLARCOBB;FONDO LATINOAMERICANO DE RESERVAS;BOGOTA;BOGOTA;Active;COLOMBIA;84A 12-18 FLOOR 7   
FLBKUS33;FULTON BANK, N.A.;LANCASTER;LANCASTER;Active;UNITED STATES OF AMERICA;PENN SQUARE, 1    
FLESDEMM;BANKHAUS MAX FLESSA KG;SCHWEINFURT;SCHWEINFURT;Active;Germany;SCHWEINFURT    
FLORNL2A;NEDERLANDSCHE BANK (DE) N.V.;AMSTERDAM;AMSTERDAM;Active;Netherlands;AMSTERDAM    
FMBKDEMM;CACEIS BANK, GERMANY BRANCH;MUENCHEN;CACEIS Bank, Muenchen;Active;Germany;CACEIS Bank, Muenchen    
FMBZBWGA;ACCESS BANK BOTSWANA LIMITED;GABORONE;GABORONE;Active;BOTSWANA;ACEESS HOUSE FAIRGROUND OFFICE PARK 62433 FAIRGROUND OFFICE PAR   
FMBZMZMX;ACCESS BANK MOZAMBIQUE, SA (FORMERLY AFRICAN BANKING CORPORATION MOZAMBIQUE);MAPUTO;MAPUTO;Active;MOZAMBIQUE;MAPUTO BUSINESS TOWER BUILDING BAIRROCENTRALC,DESPORTISTAS ST 480   
FMBZZMLX;AFRICAN BANKING CORPORATION ZAMBIA;LUSAKA;LUSAKA;Active;ZAMBIA;CORNER OF CHURCH/NASSER ROADS ATLAS MARA HOUSE  FLOOR GROUND RIDGEWAY
FMBZZWHX;AFRICAN BANKING CORP.OF ZIMBABWE LTD.;HARARE;HARARE;Active;ZIMBABWE;BANC ABC 1 ENDEAVOUR CRESCENT  MOUNT PLEASANT BUSINESS PARK 
FMERMWMW;FIRST CAPITAL BANK PLC., MALAWI;BLANTYRE;#N/A;Active;MALAWI;#N/A
FMOSRUMM;CREDIT EUROPE BANK (RUSSIA) LTD.;MOSCOW;MOSCOW;Active;Russian Federation;MOSCOW    
FNBOUS44;FIRST NATIONAL BANK;OMAHA;OMAHA;Active;UNITED STATES OF AMERICA;DODGE STREET, 1620    
FNNBBHBM;FINANSBANK A.S. BAHRAIN BRANCH;MANAMA;MANAMA;Active;BAHRAIN;GOVERNMENT AVE ROAD, 383 BUILDING 150   BLOCK 315, FLAT 51
FNNBROBU;CREDIT EUROPE BANK (ROMANIA) S.A.;BUCHAREST;BUCHAREST;Active;ROMANIA;BULEVARDUL TIMISOARA, 26Z   SECTOR 6 
FNNBTRIS;QNB FINANSBANK A.S.;ISTANBUL;MAIN BRANCH AND HEAD OFFICE;Active;TURKEY;KRISTAL KULE BINASI BUYUKDERE CAD. 215 SISL   
FNNBTRISAHL;QNB FINANSBANK A.S.;ISTANBUL;ATATURK HAVALIMANI FREE ZONE BRANCH, ISTANBUL;Active;TURKEY;ATATURK HAVALIMANI FREE ZONE BRANCH, ISTANBUL    
FNNBTRISOPS;QNB FINANSBANK A.S.;ISTANBUL;HEAD OFFICE OPERATIONS CENTER;Active;Turkey;HEAD OFFICE OPERATIONS CENTER    
FNNBTRISTPK;QNB FINANSBANK A.S.;ISTANBUL;TOPKAPI BRANCH;Active;TURKEY;TOPKAPI    
FNNBTRISTRO;QNB FINANSBANK A.S.;ISTANBUL;TREASURY OPERATIONS;Active;Turkey;TREASURY OPERATIONS    
FOBLBSNS;FIRST OVERSEAS BANK LIMITED;NASSAU;NASSAU;Active;BAHAMAS;WEST BAY STREET BUILDING 8  CAVES VILLAGE OFFIC2
FOISUS33;FORTIS INVESTMENT SERVICES LLC;NEW YORK,NY;#N/A;Active;UNITED STATES;#N/A
FOREEE2X;DANSKE BANK A/S ESTONIA BRANCH;TALLINN;TALLINN;Active;Estonia;TALLINN    
FPBIPAPA;FPB BANK INC.;PANAMA;#N/A;Active;PANAMA;#N/A
FRABFRP1;BANQUE FRANCAISE MUTUALISTE;PARIS;PARIS;Active;France;PARIS    
FRBBUS6S;FIRST REPUBLIC BANK;SAN FRANCISCO;SAN FRANCISCO;Active;United States;SAN FRANCISCO    
FRBKNL2L;FRIESLAND BANK;LEEUWARDEN;Head Office;Active;Netherlands;Head Office    
FRCGBWGA;FIRST CAPITAL BANK LIMITED;GABORONE;GABORONE;Active;BOTSWANA;-2ND COMMERCIAL RD NEW CBD 1ST CAPITAL HOUSE  FLOOR 1 
FRCGMWMW;FIRST CAPITAL BANK PLC., MALAWI;BLANTYRE;BLANTYRE;Active;MALAWI;LIVINGSTONE TOWERS FLOOR 1  GLYN JONES ROAD 
FRCGZMLU;FIRST CAPITAL BANK LIMITED;LUSAKA;LUSAKA;Active;ZAMBIA;JUNCTION OF TITO ROAD CHURCH ROAD, OPP ZAMTEL - KWACHA PENSION TRUST  FUND HOUSE - FLOOR GRND - 
FRNYUS33;FEDERAL RESERVE BANK OF NEW YORK;NEW YORK;33 Liberty St;Active;United States;33 Liberty St    
FRSTUS44;FROST BANK;SAN ANTONIO;100 W Houston St;Active;United States;100 W Houston St    
FSABLBBX;FRANSABANK SAL;BEIRUT;BEIRUT;Active;Lebanon;BEIRUT    
FSBCCNSH;FUBON BANK (CHINA) CO., LTD;SHANGHAI;SHANGHAI;Active;China;SHANGHAI    
FSCBMUMU;BANK ONE LTD;PORT LOUIS;#N/A;Active;MAURITIUS;#N/A
FSDHNGLA;FSDH MERCHANT BANK LTD;LAGOS;LAGOS;Active;NIGERIA;ODUNLAMI STREET, 1/5 UAC HOUSE  FLOOR 5-8 
FSTISLFR;VISTA BANK (SL) LIMITED;FREETOWN;FREETOWN;Active;SIERRA LEONE;CHARLOTTE STREET 2  FIRST INTERNATIONAL BANK 
FSUICHGG;CREDIT EUROPE BANK (SUISSE) S.A.;GENEVA;GENEVA;Active;Switzerland;GENEVA    
FTBCUS3C;FIFTH THIRD BANK, NATIONAL ASSOCIATION;CINCINNATI;Fifth Third Center;Active;United States;Fifth Third Center    
FTBCUS3CT01;FIFTH THIRD BANK TRADE SERVICES;;OHIO;Active;United States;OHIO    
FTBCUS3CT02;FIFTH THIRD BANK TRADE SERVICES;;MICHIGAN;Active;United States;MICHIGAN    
FTBKGB2B;AIB GROUP (UK) PLC, AIB (NI);BELFAST;BELFAST;Active;UNITED KINGDOM;ANN STREET 92  FIRST TRUST CENTRE 
FTBMUS44;FIRST HORIZON BANK;MEMPHIS;MEMPHIS;Active;UNITED STATES OF AMERICA;MADISON AVENUE, 165    
FTBMUS44CHA;FIRST HORIZON BANK;CHATTANOOGA;Chattanooga Main;Active;United States;Chattanooga Main    
FTBMUS44KXV;FIRST HORIZON BANK;KNOXVILLE;Downtown West;Active;United States;Downtown West    
FTSBNL2R;ABN AMRO BANK N.V. (FORMELY KNOWN AS FORTIS BANK (NEDERLAND) N.V.);ALL DUTCH OFFICES;#N/A;Active;NETHERLANDS;#N/A
FTSBUS33;ABN AMRO CAPITAL USA LLC;NEW YORK;NEW YORK;Active;United States;NEW YORK    
FUIBUA2X;FIRST UKRAINIAN INTERNATIONAL BANK;KYIV;HEAD OFFICE;Active;Ukraine;HEAD OFFICE    
FVLBNL22;VAN LANSCHOT KEMPEN N.V;S-HERTOGENBOSCH;S-HERTOGENBOSCH;Active;NETHERLANDS;HOOGE STEENWEG, 29    
GABAARBA;BANCO DE GALICIA Y BUENOS AIRES;BUENOS AIRES;BUENOS AIRES;Active;ARGENTINA;TTE. GRAL. JUAN DOMINGO PERON, 407    
GAZPLULL;BANK GPB INTERNATIONAL S.A.;LUXEMBOURG;LUXEMBOURG;Active;Luxembourg;LUXEMBOURG    
GAZPRUMM;GAZPROMBANK (JOINT - STOCK COMPANY);MOSCOW;MOSCOW;Active;Russian Federation;MOSCOW    
GBMCMRMR;GENERALE DE BANQUE DE MAURITANIE POUR L'INVESTISSEMENT ET LE COMMERCE;NOUAKCHOTT;Agence Centrale;Active;Mauritania;Agence Centrale    
GBMSMXM1;GBM GRUPO BURSATIL MEXICANO, S.A.B. DE C.V. CASA E BOLSA;CIUDAD DE MEXICO;MEXICO;Active;MEXICO;AV. INSURGENTES SUR 1605 COL. SAN JOSE INSURGENTES  FLOOR 31 
GBSEZAJJ;GENBEL SECURITIES PROPRIETARY LIMITED;JOHANNESBURG;JOHANNESBURG;Active;South Africa;JOHANNESBURG    
GBSLGB2L;TP ICAP MARKETS LIMITED;LONDON;LONDON;Active;UNITED KINGDOM;BISHOPSGATE 135   
GEBABEBB;BNP PARIBAS FORTIS (FORTIS BANK SA/NV);BRUSSELS;ALL BELGIAN OFFICES;Active;Belgium;ALL BELGIAN OFFICES    
GEBABEBB01A;BNP PARIBAS FORTIS (FORTIS BANK SA/NV);AALST;AALST;Active;BELGIUM;KWALESTRAAT 94 NIEUWERKERKEN   
GEBABEBB01B;BNP PARIBAS FORTIS (FORTIS BANK SA/NV);SINT-NIKLAAS;SINT-NIKLAAS;Active;BELGIUM;KARDINAAL MERCIERPLEIN 7    
GEBABEBB08A;BNP PARIBAS FORTIS (FORTIS BANK SA/NV);LEUVEN;LEUVEN;Active;BELGIUM;KAREL VAN LOTHARINGENSTRAAT 4    
GEBABEBB12A;BNP PARIBAS FORTIS (FORTIS BANK SA/NV);VERVIERS;VERVIERS;Active;BELGIUM;PLACE VERTE 12A    
GEBABEBB18A;BNP PARIBAS FORTIS (FORTIS BANK SA/NV);ANTWERPEN;ANTWERPEN;Active;BELGIUM;MEIR 48    
GEBABEBB36A;BNP PARIBAS FORTIS (FORTIS BANK SA/NV);BRUSSELS;HEAD OFFICE;Active;BELGIUM;MONTAGNE DU PARC 3    
GEBABEBBCLS;FORTIS BANK S.A./N.V. BRUSSELS;BRUSSELS;#N/A;Active;BELGIUM;#N/A
GEBACNSH;FORTIS BANK S.A./ N.V., SHANGHAI BRANCH;SHANGHAI;#N/A;Active;CHINA;#N/A
GEBADE33;BNP PARIBAS S.A. NIEDERLASSUNG DEUTSCHLAND (FORMERLY BNP PARIBAS FORTIS SA/NV);FRANKFURT AM MAIN;FRANKFURT AM MAIN;Active;GERMANY;SENCKENBERGANLAGE 19    
GEBAFRPP;FORTIS BANK SA/NV, PARIS BRANCH;PUTEAUX;#N/A;Active;FRANCE;#N/A
GEBAGB22;BNP PARIBAS LONDON BRANCH (FORMERLY BNP PARIBAS FORTIS SA/NV);LONDON;LONDON;Active;UNITED KINGDOM;HAREWOOD AVENUE 10   
GEBAHKHH;FORTIS BANK, HONG KONG BRANCH;HONG KONG;#N/A;Active;HONG KONG;#N/A
GEBASGSG;FORTIS BANK S.A./N.V., SINGAPORE;SINGAPORE;#N/A;Active;SINGAPORE;#N/A
GEBASGSGTCF;FORTIS BANK S.A./N.V., SINGAPORE;SINGAPORE;#N/A;Active;SINGAPORE;#N/A
GEBAUS33;BNP PARIBAS FORTIS NEW YORK BRANCH;JERSEY CITY;Equitable Tower;Active;United States;Equitable Tower    
GEIEIN51;GEOJIT FINANCIAL SERVICES LIMITED;MUMBAI;MUMBAI;Active;India;MUMBAI    
GENEUS33DBL;GENERAL ELECTRIC COMPANY;NORWALK;NORWALK;Active;UNITED STATES OF AMERICA;MAIN AVE, 901    
GENOCHZZ;DZ PRIVATBANK (SCHWEIZ) AG;ZUERICH;ZURICH;Active;Switzerland;ZURICH    
GENODE51WW1;WESTERWALD BANK EG;MONTABAUR;Westerwald Bank;Active;GERMANY;KIRCHSTRASSE 2-4    
GENODE55;DZ BANK AG DEUTSCHE ZENTRAL-GENOSSENSCHAFTSBANK, FRANKFURT BRANCH;FRANKFURT AM MAIN;DZ Bank;Active;Germany;DZ Bank    
GENODE6K;DZ BANK AG DEUTSCHE ZENTRAL-GENOSSENSCHAFTSBANK,FRANKFURT BRANCH;KARLSRUHE;DZ BANK;Active;Germany;DZ BANK    
GENODEDD570;DZ BANK AG (FORMERLY WGZ BANK AG);KOBLENZ;DZ BANK Koblenz;Active;GERMANY;ROONSTRASSE 7    
GENODEF1WFV;VOLKSBANK EG;WOLFENBUETTEL;Volksbank;Active;GERMANY;AM HERZOGTOR 12-12A    
GENODEFF;DZ BANK AG DEUTSCHE ZENTRAL-GENOSSENSCHAFTSBANK;FRANKFURT AM MAIN;DZ BANK;Active;Germany;DZ BANK    
GENODEFF120;DZ BANK AG DEUTSCHE ZENTRAL-GENOSSENSCHAFTSBANK;BERLIN;DZ BANK;Active;GERMANY;FRIEDRICHSTRASSE 61    
GENODEFF200;DZ BANK AG DEUTSCHE ZENTRALGENOSSENSCHAFTSBANK;HAMBURG;DZ BANK;Active;GERMANY;ROSENSTRASSE 2    
GENODEFF250;DZ BANK AG DEUTSCHE ZENTRAL-GENOSSENSCHAFTSBANK;HANNOVER;DZ BANK;Active;GERMANY;BERLINER ALLEE 5   DG BANK BUILDING 
GENODEFF280;DZ BANK AG DEUTSCHE ZENTRAL-GENOSSENSCHAFTSBANK;OLDENBURG;DZ BANK Hannover;Active;GERMANY;RAIFFEISENSTRASSE 22-23    
GENODEFF520;DZ BANK AG DEUTSCHE ZENTRAL-GENOSSENSCHAFTSBANK;KASSEL;DZ BANK;Active;GERMANY;STAENDEPLATZ 1-3   RAIFFEISENHAUS 
GENODEFF701;DZ BANK AG DEUTSCHE ZENTRAL-GENOSSENSCHAFTSBANK;MUENCHEN;DZ BANK Muenchen;Active;GERMANY;TUERKENSTRASSE 16    
GENODEMS;DZ BANK AG (FORMERLY WGZ BANK);MUENSTER;MUENSTER;Active;GERMANY;SENTMARINGER WEG, 1    
GENODESG;DZ BANK AG DEUTSCHE ZENTRAL-GENOSSENSCHAFTSBANK, STUTTGART BRANCH;STUTTGART;DZ BANK;Active;Germany;DZ BANK    
GENOGB2L;DZ BANK AG DEUTSCHE ZENTRAL-GENOSSENSCHAFTSBANK;LONDON;LONDON;Active;UNITED KINGDOM;CHEAPSIDE 150   
GENOHKHH;DZ BANK HONG KONG BRANCH;CENTRAL;ADMIRALTY;Active;HONG KONG;HARCOURT ROAD, 18 ADMIRALTY CENTRE TOWER II  FLOOR 9 
GENOLULL;DZ PRIVATBANK S.A., LUXEMBOURG;LUXEMBOURG;LUXEMBOURG;Active;Luxembourg;LUXEMBOURG    
GENOPLPW;DZ BANK AG S.A. POLAND BRANCH;WARSZAWA;#N/A;Active;POLAND;#N/A
GENOUS33;DZ BANK AG DEUTSCHE ZENTRAL-GENOSSENSCHAFTSBANK, NEW YORK BRANCH;NEW YORK;NEW YORK;Active;United States;NEW YORK    
GENRMUM1;SWAN SECURITIES LTD;PORT LOUIS;PORT LOUIS;Active;Mauritius;PORT LOUIS    
GEROCOBB;BANCO BILBAO VIZCAYA ARGENTARIA COLOMBIA S.A.;BOGOTA;BOGOTA;Active;COLOMBIA;CARRERA 9,  72-21   FLOOR 5 
GFIGGB2L;GFI SECURITIES LTD;LONDON;LONDON;Active;United Kingdom;LONDON    
GHBAGRAA;GENERAL BANK OF GREECE SA;ATHENS;MAIN;Active;GREECE;MAIN
GHBAGRAAGSS;GENERAL BANK OF GREECE SA;ATHENS;#N/A;Active;GREECE;#N/A
GHCBGHAC;GCB BANK PLC;ACCRA;ACCRA;Active;GHANA;THORPE ROAD/HIGH STREET    
GHIBGB2L;GHANA INTERNATIONAL BANK PLC;LONDON;LONDON;Active;United Kingdom;LONDON    
GIBAATWG;ERSTE GROUP BANK AG;VIENNA;WIEN;Active;Austria;WIEN    
GIBAATWW;ERSTE BANK DER OESTERREICHISCHEN SPARKASSEN AG;VIENNA;WIEN;Active;Austria;WIEN    
GIBACZPX;CESKA SPORITELNA A.S.;PRAGUE;PRAHA;Active;CZECHIA;OLBRACHTOVA 62    
GIBAGB2X;ERSTE GROUP BANK AG (FORMER ERSTE BANK);LONDON;LONDON;Active;UNITED KINGDOM;110 BISHOPSGATE FLOOR 24   
GIBAHUHB;ERSTE BANK HUNGARY ZRT;BUDAPEST;BUDAPEST;Active;Hungary;BUDAPEST    
GIBARS22;ERSTE BANK A.D. NOVI SAD;NOVI SAD;NOVI SAD;Active;SERBIA;BULEVAR OSLOBODJENJA , 5    
GIBASKBX;SLOVENSKA SPORITELNA, A.S.;BRATISLAVA;BRATISLAVA;Active;SLOVAKIA;TOMASIKOVA 48    
GIBAUS33;ERSTE GROUP BANK AG;NEW YORK;Rockefeller Plaza;Active;United States;Rockefeller Plaza    
GILLNL2A;INSINGERGILISSEN, A QUINTET PRIVATE BANK (EUROPE) S.A. BRANCH;AMSTERDAM;AMSTERDAM;Active;Netherlands;AMSTERDAM    
GIRCCWCC;GIROBANK INTERNATIONAL N.V.;WILLEMSTAD;WILLEMSTAD;Active;CURACAO;WILLEMSTAD    
GKCCBEBB;BELFIUS BANK SA/NV;BRUSSELS;HEAD OFFICE;Active;Belgium;HEAD OFFICE    
GLBAUS33;MF GLOBAL INC;NEW YORK,NY;#N/A;Active;UNITED STATES;#N/A
GLENCH2Z;GLENCORE INTERNATIONAL AG;Baar;BAAR;Active;Switzerland;BAAR    
GLITISRE;ISLANDSBANKI HF;KOPAVOGUR;KOPAVOGUR;Active;ICELAND;HAGASMARI 3   
GLKBCH22;GLARNER KANTONALBANK;GLARUS;GLARUS;Active;Switzerland;GLARUS    
GLMTMNUB;GOLOMT BANK OF MONGOLIA;ULAANBAATAR;ULAANBAATAR;Active;MONGOLIA;5 D.SUKHBAATARS SQUARE    
GMGUGGSP;INVESTEC BANK (CHANNEL ISLANDS) LIMITED;ST. PETER PORT;ST. PETER PORT;Active;GUERNSEY;GLATEGNY ESPLANADE GLATEGNY COURT   
GNESIDJA;PT. BANK GANESHA;JAKARTA;JAKARTA;Active;INDONESIA;WISMA HAYAM WURUK FLOOR 1  8 JL HAYAM WURUK 
GNILGB2L;MF GLOBAL UK LIMITED;LONDON;C/O INTERPATH LTD;Active;UNITED KINGDOM;C/O KPMG LLP 15  CANADA SQUARE 
GOAFHKHX;GOLDMAN SACHS (ASIA) FINANCE;CENTRAL;CENTRAL;Active;HONG KONG;QUEEN'S ROAD, 2 CHEUNG KONG CENTRE  FLOOR 68 
GOHOIDJ1;CGS-CIMB SEKURITAS INDONESIA, PT;JAKARTA;JAKARTA;Active;INDONESIA;INDONESIA STOCK EXCHANGE BUILDING TOWER 2 FLOOR 20  52-53 JL. JEND. SUDIRMAN 
GOLDAU2S;GOLDMAN SACHS FINANCIAL MARKETS PTY LTD;SYDNEY;SYDNEY;Active;AUSTRALIA;FARRER PLACE 1  GOVERNOR PHILLIP TOWER FLOOR 47
GOLDBRSP;GOLDMAN SACHS DO BRASIL BANCO MULTIPLO S.A.;SAO PAULO;SAO PAULO;Active;BRAZIL;R LEOPOLDO COUTO DE MAGALHAES JR700    
GOLDCHZZ;GOLDMAN SACHS BANK AG;ZUERICH;ZURICH;Active;Switzerland;ZURICH    
GOLDDEFA;GOLDMAN SACHS BANK EUROPE SE;FRANKFURT AM MAIN;FRANKFURT AM MAIN;Active;GERMANY;FRIEDRICH-EBERT-ANLAGE, 49    
GOLDDEFB;GOLDMAN SACHS BANK EUROPE SE;FRANKFURT AM MAIN;FRANKFURT AM MAIN;Active;GERMANY;MARIENTURM TAUNUSANLAGE 9-10   
GOLDJPJX;GOLDMAN SACHS JAPAN CO., LTD.;MINATO;TOKYO;Active;Japan;TOKYO    
GOLDLULL;GOLDMAN SACHS BANK EUROPE SE, LUXEMBOURG BRANCH;LUXEMBOURG;LUXEMBOURG;Active;LUXEMBOURG;BLD. GRANDE-DUCHESSE CHARLOTT 32-34   
GOLDNL2A;GOLDMAN SACHS BANK EUROPE SE, AMSTERDAM BRANCH;AMSTERDAM;AMSTERDAM;Active;Netherlands;AMSTERDAM    
GOLDUS33;GOLDMAN SACHS AND CO. LLC;NEW YORK;NEW YORK;Active;UNITED STATES OF AMERICA;WEST STREET, 200    
GORESI2X;GORENJSKA BANKA D.D., KRANJ;KRANJ;KRANJ;Active;SLOVENIA;BLEIWEISOVA CESTA , 1    
GRENGLGX;GRONLANDSBANKEN A/S;NUUK;NUUK;Active;GREENLAND;IMANEQ 33   
GRIDZAJJ;GRINDROD BANK LIMITED;DURBAN;DURBAN;Active;SOUTH AFRICA;KINGSMEAD OFFICE PARK 20 KINGSMEAD BOULEVARD   
GRKBCH2270A;GRAUBUENDNER KANTONALBANK;CHUR;CHUR;Active;SWITZERLAND;ENGADINSTRASSE 27    
GRNWUS33;NATWEST MARKETS SECURITIES INC.;STAMFORD;STAMFORD;Active;UNITED STATES OF AMERICA;WASHINGTON BLVD, 600    
GSAEDEFF;GOLDMAN SACHS EUROPE SE;FRANKFURT AM MAIN;FRANKFURT AM MAIN;Active;Germany;FRANKFURT AM MAIN    
GSAMUS33;GOLDMAN SACHS ASSET MANAGEMENT, L.P.;NEW YORK;NEW YORK;Active;UNITED STATES OF AMERICA;WEST STREET, 200    
GSCMUS33;GOLDMAN SACHS BANK USA (FORMERLY GOLDMAN SACHS CAPITAL MARKETS, L.P.);NEW YORK;NEW YORK;Active;UNITED STATES OF AMERICA;WEST STREET, 200    
GSCMUS33CLS;GOLDMAN SACHS BANK USA (FORMERLY GOLDMAN SACHS CAPITAL MARKETS, L.P.);NEW YORK;NEW YORK;Active;UNITED STATES OF AMERICA;WEST STREET, 200    
GSCRJPJT;GOLDMAN SACHS BANK USA TOKYO BRANCH;MINATO;TOKYO;Active;JAPAN;ROPPONGI HILLS MORI TOWER 6-10-1 ROPPONGI  MINATO-KU 
GSCRUS33;GOLDMAN SACHS BANK USA (FORMERLY GOLDMAN SACHS TRUST COMPANY);NEW YORK;NEW YORK;Active;UNITED STATES OF AMERICA;WEST STREET, 200    
GSICSGSG;GIC PRIVATE LIMITED;SINGAPORE;SINGAPORE;Active;Singapore;SINGAPORE    
GSILGB2X;GOLDMAN SACHS INTERNATIONAL;LONDON;LONDON;Active;UNITED KINGDOM;SHOE LANE 25  PLUMTREE COURT 
GSLDGB2L;GOLDMAN SACHS BANK USA LONDON BRANCH;LONDON;LONDON;Active;UNITED KINGDOM;SHOE LANE 25  PLUMTREE COURT 
GSTRUS33;GOLDMAN SACHS BANK USA (FORMERLY THE GOLDMAN SACHS TRUST COMPANY);NEW YORK;NEW YORK;Active;UNITED STATES OF AMERICA;200 WEST STREET    
GTBIGB2L;GUARANTY TRUST BANK (UK) LIMITED;LONDON;LONDON;Active;UNITED KINGDOM;MARGARET STREET 62   
GTBIGHAC;GUARANTY TRUST BANK (GHANA) LTD;ACCRA;ACCRA;Active;GHANA;A CASTLE ROAD, 25 AMBASSADORIAL AREA  RIDGE 
GTBIKENA;GUARANTY TRUST BANK (KENYA) LTD;NAIROBI;NAIROBI;Active;KENYA;KIMATHI STREET , 209/XII/624 FINA HOUSE   
GTBINGLA;GUARANTY TRUST BANK PLC;VICTORIA ISLAND;VICTORIA ISLAND;Active;NIGERIA;AKIN ADESOLA STREET, 635   VICTORIA ISLAND 
GTBIRWRK;GUARANTY TRUST BANK (RWANDA) PLC;KIGALI;KIGALI;Active;RWANDA;KN2 AVE GROUND AND FIRST FLOOR  MIC FLOOR 1 
GTBKINBB015;ORIENTAL BANK OF COMMERCE;BANGALORE;#N/A;Active;INDIA;#N/A
GTRDBMHM;G-TRADE SERVICES LLC;HAMILTON;HAMILTON;Active;BERMUDA;HAMILTON
GUARKENA;GUARDIAN BANK LIMITED;NAIROBI;NAIROBI;Active;KENYA;BIASHARA STREET GUARDIAN CENTRE   
GUAYECEG;BANCO GUAYAQUIL S.A.;GUAYAQUIL;GUAYAQUIL;Active;ECUADOR;FRANCISCO P. ICAZA Y PICHINCHA, 107    
GULBKWKW;GULF BANK, K.S.C.P.;KUWAIT;KUWAIT;Active;KUWAIT;MUBARAK AL-KABIR STREET    
GULFBHBM;GULF INTERNATIONAL BANK, B.S.C.;MANAMA;MANAMA;Active;Bahrain;MANAMA    
GULFGB2L;GULF INTERNATIONAL BANK B.S.C.;LONDON;LONDON;Active;UNITED KINGDOM;ONE KNIGHTSBRIDGE    
GULFSARI;GULF INTERNATIONAL BANK (GIB) SAUDI ARABIA,       S.C.J.S.C.;DHAHRAN;DHAHRAN;Active;SAUDI ARABIA;AL KIFAH TOWER DAMMAM KHOBAR HIGHWAY  KING FAHAD ROAD 
GULFUS33;GULF INTERNATIONAL BANK;NEW YORK;NEW YORK,NY;Active;United States;NEW YORK,NY    
GUTBATWW;BANK GUTMANN AG;VIENNA;WIEN;Active;AUSTRIA;Schwarzenbergpl. 16    
GUYECHZZ;HSBC PRIVATE BANK (SUISSE) SA;ZURICH;#N/A;Active;SWITZERLAND;#N/A
GYMKTRI1;GARANTI YATIRIM MENKUL KIYMETLER ANONIMSIRKETI;ISTANBUL;ISTANBUL;Active;TURKEY;GARANTI BINASI. NISPETIYE MAHAL 2/8 AYTAR CADDESI., LEVENT  FLOOR 8 
HAABAT2K;AUSTRIAN ANADI BANK AG;KLAGENFURT AM WOERTHERSEE;KLAGENFURT;Active;Austria;KLAGENFURT    
HAABHR22;ADDIKO BANK D.D.;ZAGREB;ZAGREB;Active;Croatia;ZAGREB    
HAABSI22;ADDIKO BANK D.D.;LJUBLJANA;LJUBLJANA;Active;SLOVENIA;DUNAJSKA , 117 STEKLENI DVOR   
HABAEE2X;SWEDBANK AS;TALLINN;TALLINN;Active;ESTONIA;LIIVALAIA , 8    
HABALT22;SWEDBANK AB;VILNIUS;Swedbank, AB;Active;Lithuania;Swedbank, AB    
HABALV22;SWEDBANK AS;RIGA;RIGA;Active;LATVIA;BALASTA DAMBIS , 1A    
HABARUMM;OAO SWEDBANK;MOSCOW;#N/A;Active;RUSSIAN FEDERATION;#N/A
HABBAEAD;HABIB BANK LIMITED;DUBAI;DUBAI;Active;UNITED ARAB EMIRATES;AL-ABBAS BUILDING FLOOR MEZZANINE  KHALID BIN WALEED ROAD 
HABBBEBB;HABIB BANK LTD.;BRUSSELS;BRUSSELS;Active;Belgium;BRUSSELS    
HABBBHBM;HABIB BANK LTD.;MANAMA;MANAMA;Active;BAHRAIN;BUILDING 1130 BLOCK 215, ROAD 10   
HABBFRPP;HABIBSONS BANK LIMITED;PARIS;#N/A;Active;FRANCE;#N/A
HABBGB2L;HBL BANK UK LIMITED;LONDON;LONDON;Active;UNITED KINGDOM;PORTMAN STREET 9   
HABBKENX;HABIB BANK LIMITED;NAIROBI;NAIROBI;Active;KENYA;NAIROBI
HABBLKLC;HABIB BANK LTD.;COLOMBO;COLOMBO;Active;SRI LANKA;2ND CROSS STREET, 140-142    11 COLOMBO
HABBMUMU;HABIB BANK LTD MAURITIUS;PORT LOUIS;PORT LOUIS;Active;MAURITIUS;SIR WILLIAM NEWTON STREET    
HABBMVMV;HABIB BANK LIMITED;MALE;MALE;Active;MALDIVES;BODUTHAKURUFAANU MAGU 1-6  H THUNIYA BUILDING FLOOR 1
HABBPKKA;HABIB BANK LIMITED;KARACHI;KARACHI;Active;PAKISTAN;HASRAT MOHANI ROAD, I.I. CHUNDRIGAR ROAD - ANNEXE BUILDING -  FLOOR 6 - 
HABBPKKA007;HABIB BANK LIMITED;KARACHI;FOREIGN EXCHANGE BRANCH - HABIB SQUARE;Active;PAKISTAN;M.A. JINNAH ROAD    
HABBPKKA242;HABIB BANK LIMITED;LAHORE;CENTRE BRANCH;Active;PAKISTAN;HABIB BANK CENTRE, 102/103    UPPER MALL
HABBPKKATRY;HABIB BANK LIMITED;KARACHI;HEAD OFFICE - TREASURY;Active;PAKISTAN;FINLAY HOUSE I-I-CHUNDRIGAR ROAD   
HABBSCS1;HABIB BANK LIMITED;VICTORIA;#N/A;Active;SEYCHELLES;#N/A
HABBSGSG;HABIB BANK LIMITED;SINGAPORE;SINGAPORE;Active;Singapore;SINGAPORE    
HABBUS33;HABIB BANK LIMITED;NEW YORK;NEW YORK;Active;United States;NEW YORK    
HABKJPJT;HACHIJUNI BANK, LTD., THE;CHUO;Head Office Sales Department;Active;Japan;Head Office Sales Department    
HAMAJPJT;BANK OF YOKOHAMA, LTD., THE;CHIYODA;TOKYO;Active;JAPAN;KANDA HIGASHINIPPON BUILDING FLOOR 6  2 KANDATOMIYAMACHO CHIYODA KU
HAMBGB2L;SG KLEINWORT HAMBROS BANK LIMITED;LONDON;LONDON;Active;UNITED KINGDOM;TOWER HILL 41  SG HOUSE 
HAMBJESX;SG KLEINWORT HAMBROS BANK LIMITED - JERSEY BRANCH;ST. HELIER;ST. HELIER;Active;JERSEY;ESPLANADE, 18    
HANDDEFF;SVENSKA HANDELSBANKEN AB (PUBL), ZWEIGNIEDERLASSUNG DEUTSCHLAND;FRANKFURT AM MAIN;FRANKFURT AM MAIN;Active;GERMANY;BLEICHSTRASSE 52    
HANDDKKK;JYSKE BANK A/S (FORMERLY HANDELSBANKEN);COPENHAGEN;COPENHAGEN;Active;DENMARK;HAVNEHOLMEN, 29    
HANDFIHH;SVENSKA HANDELSBANKEN;HELSINKI;HELSINKI;Active;FINLAND;ITAMERENKATU 11-13    
HANDGB22;HANDELSBANKEN PLC;LONDON;LONDON;Active;UNITED KINGDOM;TMS 3  THOMAS MORE SQUARE 
HANDGB22SWP;SVENSKA HANDELSBANKEN LONDON BRANCH;LONDON;(SWAP UNIT);Active;United Kingdom;(SWAP UNIT)    
HANDHKHH;SVENSKA HANDELSBANKEN HONG KONG BRANCH;WAN CHAI;WAN CHAI;Active;HONG KONG;10 HARCOURT ROAD CENTRAL AND WESTERN DISTRICT  2008 HUTCHISON HOUSE 
HANDLULB;SVENSKA HANDELSBANKEN AB(PUBL)LUX;LUXEMBOURG;LUXEMBOURG;Active;Luxembourg;LUXEMBOURG    
HANDNOKK;HANDELSBANKEN;OSLO;OSLO;Active;Norway;OSLO    
HANDPLPW;SVENSKA HANDELSBANKEN AB SPOLKA AKCYJNA ODDZIAL W POLSCE;WARSZAWA;WARSZAWA;Active;POLAND;WOLOSKA , 22    
HANDRUMM;COMMERCIAL BANK SVENSKA HANDELSBANKEN (CLOSED JOINT STOCK COMPANY);MOSCOW;#N/A;Active;RUSSIAN FEDERATION;#N/A
HANDSESG;SVENSKA HANDELSBANKEN;GOTEBORG;#N/A;Active;SWEDEN;#N/A
HANDSESM;SVENSKA HANDELSBANKEN;MALMO;#N/A;Active;SWEDEN;#N/A
HANDSESS;SVENSKA HANDELSBANKEN AB;STOCKHOLM;STOCKHOLM;Active;Sweden;STOCKHOLM    
HANDSESSCLS;SVENSKA HANDELSBANKEN AB;STOCKHOLM;STOCKHOLM;Active;Sweden;STOCKHOLM    
HANDSGSG;SVENSKA HANDELSBANKEN, SINGAPORE BRANCH;SINGAPORE;Singapore Branch;Active;Singapore;Singapore Branch    
HANDUS33;SVENSKA HANDELSBANKEN;NEW YORK;NEW YORK;Active;UNITED STATES OF AMERICA;THIRD AVENUE, 875   FLOOR 4 
HANMUS6L;HANMI BANK;LOS ANGELES;LOS ANGELES;Active;UNITED STATES OF AMERICA;WILSHIRE BOULEVARD, 3660    
HANYUS33;HABIB AMERICAN BANK;NEW YORK;Manhattan;Active;United States;Manhattan    
HASECNSH;HANG SENG BANK (CHINA) LIMITED;SHANGHAI;SHANGHAI;Active;China;SHANGHAI    
HASEHKHH;HANG SENG BANK LIMITED;CENTRAL;CENTRAL;Active;HONG KONG;DES VOEUX ROAD , 83    
HATRUS44;BMO HARRIS BANK N.A.;CHICAGO;CHICAGO;Active;UNITED STATES OF AMERICA;WEST MONROE STREET, 111    
HAUKDEFF;HAUCK AUFHAEUSER LAMPE PRIVATBANK AG;FRANKFURT AM MAIN;FRANKFURT AM MAIN;Active;GERMANY;KAISERSTRASSE 24    
HBCLNGLA;HERITAGE BANK PLC;LAGOS;LAGOS;Active;NIGERIA;MOSHOOD OLUGBANI STREET, 171A    
HBHOJOAX;HOUSING BANK FOR TRADE AND FINANCE, THE;AMMAN;CENTRAL OPERATIONS;Active;JORDAN;AL-SHUMAYSANI-PRINCE SHAKER BIN ZAID STREET -   
HBIDHUHB;HUNGARIAN DEVELOPMENT BANK PLC;BUDAPEST;BUDAPEST;Active;Hungary;BUDAPEST    
HBLILKLX;HATTON NATIONAL BANK PLC;COLOMBO;COLOMBO;Active;SRI LANKA;T B JAYAH MAWATHA, 479 HNB TOWERS  FLOOR 11 
HBMBMYKL;HSBC BANK MALAYSIA BERHAD;KUALA LUMPUR;KUALA LUMPUR;Active;MALAYSIA;LEBOH AMPANG 2   
HBMEAEAD;HSBC BANK MIDDLE EAST LIMITED;DUBAI;DUBAI;Active;UNITED ARAB EMIRATES;DUBAI    
HBMEKWKW;HSBC BANK MIDDLE EAST LIMITED;KUWAIT;KUWAIT;Active;Kuwait;KUWAIT    
HBPEPEPL;BANCO GNB PERU SA;LIMA;LIMA;Active;PERU;CALLE BEGONIAS 415 SAN ISIDRO  OFICINAS 25,26 
HBUANL2R;DEUTSCHE BANK NEDERLAND NV (FORMER: NEW HBU II N.V.);ROTTERDAM;#N/A;Active;NETHERLANDS;#N/A
HBUKGB4B;HSBC UK BANK PLC;BIRMINGHAM;BIRMINGHAM;Active;UNITED KINGDOM;1 CENTENARY SQUARE    
HBZHZAJJ;HBZ BANK LIMITED;WESTVILLE;DURBAN;Active;SOUTH AFRICA;135 JAN HOFMEYR ROAD WESTVILLE   
HBZUAEAD;HABIB BANK AG ZURICH;DUBAI;DUBAI;Active;UNITED ARAB EMIRATES;BENIYAS SQUARE DEIRA   
HBZUCHZZ;HABIB BANK AG ZURICH;ZUERICH;ZURICH;Active;Switzerland;ZURICH    
