BIC_SWIFTCODE;INSTITUTIONNAME;CITYNAME;BRANCHINFO;STATUS;COUNTRYNAME;PHYSICALADDRESS
NBSHAEAS;SHARJAH ISLAMIC BANK;SHARJAH;SHARJAH;Active;UNITED ARAB EMIRATES;SHARJAH ISLAMIC BANK TOWER    AL KHAN AREA
NBSRRSBG;NARODNA BANKA SRBIJE (NATIONAL BANK OF SERBIA - NBS);BEOGRAD;BEOGRAD;Active;SERBIA;KRALJA PETRA, 12    
NBSTMWMW;NBS BANK PLC;BLANTYRE;Head Office;Active;Malawi;Head Office    
NBTRRUMM;NATIONAL BANK TRUST;MOSCOW;MOSCOW;Active;RUSSIAN FEDERATION;IZVESTKOVY PER. , 3    
NBUAUAUX;NATIONAL BANK OF UKRAINE;KYIV;KYIV;Active;UKRAINE;9 INSTITUTSKAYA    
NCBAALTX;BANKA KOMBETARE TREGTARE SH.A.;TIRANA;TIRANA;Active;ALBANIA;RRUGA E VILAVE, LUNDER 1    
NCBKSAJE;THE SAUDI NATIONAL BANK;JEDDAH;HEAD OFFICE;Active;SAUDI ARABIA;SNB TOWER - RIYADH FLOOR 1  KING FAHD RD 
NCBKSAJE101;THE SAUDI NATIONAL BANK;JEDDAH;JEDDAH, MAIN BRANCH;Active;SAUDI ARABIA;N.C.B. HEAD OFFICE BUILDING KING ABDULAZIZ STREET   
NCBKSAJE555;THE SAUDI NATIONAL BANK;JEDDAH;TREASURY DIVISION;Active;SAUDI ARABIA;N.C.B. HEAD OFFICE BUILDING KING ABDULAZIZ STREET   
NCBTJPJT;AOZORA BANK, LTD;CHIYODA;TOKYO;Active;JAPAN;6-1-1 KOJIMACHI CHIYODA-KU   
NCCBRUMM;CENTRAL COUNTERPARTY NATIONAL CLEARING CENTRE;MOSCOW;MOSCOW;Active;RUSSIAN FEDERATION;BOLSHOY KISLOVSKIY PER. , 13    
NCCLBDDH;NATIONAL CREDIT AND COMMERCE BANK LIMITED;DHAKA;DHAKA;Active;BANGLADESH;TOYENBEE CIRCULAR ROAD 13/1, 13/2  NCC BANK BHABAN 
NCMPGB2L;NOMURA CAPITAL MARKETS LIMITED;LONDON;LONDON;Active;United Kingdom;LONDON    
NCREDOSD;BANCO MULTIPLE BHD LEON, S.A. (FORMERLY BANCO MULTIPLE LEON, S.A.);SANTO DOMINGO;#N/A;Active;DOMINICAN REPUBLIC;#N/A
NDBSLKLX;NATIONAL DEVELOPMENT BANK PLC.;COLOMBO;COLOMBO;Active;SRI LANKA;NAWAM MAWATHA, 40    2 COLOMBO
NDCCCNB1;CHINA CENTRAL DEPOSITORY AND CLEARING CO., LTD.;BEIJING;BEIJING;Active;China;BEIJING    
NDEADKKK;NORDEA DANMARK, FILIAL AF NORDEA BANK ABP, FINLAND;COPENHAGEN;COPENHAGEN;Active;DENMARK;GRONJORDSVEJ 10    
NDEADKKKCLS;NORDEA DANMARK, FILIAL AF NORDEA BANK ABP, FINLAND;COPENHAGEN;KOEBENHAVN;Active;DENMARK;KOEBENHAVN    
NDEAFIHH;NORDEA BANK ABP;HELSINKI;HELSINKI;Active;FINLAND;SATAMARADANKATU 5    
NDEAGB2L;NORDEA BANK ABP LONDON BRANCH;LONDON;LONDON;Active;UNITED KINGDOM;ALDERMANSBURY SQUARE 5   FLOOR 6
NDEALT2X;NORDEA BANK FINLAND PLC LITHUANIA BRANCH;VILNIUS;#N/A;Active;LITHUANIA;#N/A
NDEALULL;NORDEA BANK S.A. LUXEMBOURG;LUXEMBOURG;LUXEMBOURG;Active;Luxembourg;LUXEMBOURG    
NDEANOKK;NORDEA BANK ABP, FILIAL I NORGE;OSLO;OSLO;Active;NORWAY;ESSENDROPSGATE 7    
NDEARUMM;JSC NORDEA BANK;MOSCOW;MOSCOW;Active;Russian Federation;MOSCOW    
NDEASEGG;NORDEA BANK ABP, FILIAL I SVERIGE;GOTEBORG;GOTEBORG;Active;Sweden;GOTEBORG    
NDEASESS;NORDEA BANK ABP, FILIAL I SVERIGE;STOCKHOLM;STOCKHOLM;Active;Sweden;STOCKHOLM    
NDEASGSG;NORDEA BANK ABP SINGAPORE BRANCH;SINGAPORE;Singapore Branch;Active;Singapore;Singapore Branch    
NDEAUS3N;NORDEA BANK ABP, NEW YORK BRANCH;NEW YORK;NEW YORK;Active;UNITED STATES OF AMERICA;AVENUE OF THE AMERICAS, 1211    
NDPIUS33;NOMURA DERIVATIVE PRODUCTS INC.;NEW YORK;NEW YORK;Active;UNITED STATES OF AMERICA;WEST 49TH STREET, 309 WORLDWIDE PLAZA   
NECINL2A;EUROCLEAR NEDERLAND (PREVIOUSLY KNOWN AS NECIGEF);AMSTERDAM;AMSTERDAM;Active;Netherlands;AMSTERDAM    
NEDLLSMX;NEDBANK (LESOTHO) LIMITED;MASERU;MASERU;Active;LESOTHO;KINGSWAY ROAD    
NEDSGB2L;NEDBANK LTD;LONDON;LONDON;Active;UNITED KINGDOM;ARTHUR STREET 12   FLOOR 7
NEDSNANX;NEDBANK NAMIBIA LIMITED;WINDHOEK;WINDHOEK;Active;NAMIBIA;DR FRANS INDONGO STREET 12-20   
NEDSZAJJ;NEDBANK LIMITED;JOHANNESBURG;SANDTON;Active;SOUTH AFRICA;135 RIVONIA ROAD    
NEDVCNSH;NEW DEVELOPMENT BANK;SHANGHAI;SHANGHAI;Active;China;SHANGHAI    
NESWSZMX;NEDBANK ESWATINI LIMITED;MBABANE;MBABANE;Active;ESWATINI;ALLISTER MILLER STREET 21   
NEWGGB2L;SOCIETE GENERALE INTERNATIONAL LTD;LONDON;LONDON;Active;UNITED KINGDOM;BANK STREET ONE   
NFBKUS33;CAPITAL ONE, N.A.;MCLEAN;NEW YORK;Active;United States;NEW YORK    
NFBMMWMW;MYBUCKS BANKING CORPORATION LIMITED;LILONGWE;LILONGWE;Active;MALAWI;CONVENTION DRIVE CITY CENTRE EKISTICS HOUSE   
NFFCKRSE;SUHYUP BANK;SEOUL;SEOUL;Active;KOREA, REPUBLIC OF;OGEUM-RO, SINCHEON-DONG 62   
NFMONL2G;NEDERLANDSE FINANCIERINGS-MAATSCHAPPIJ VOOR ONTWIKKELINGSLANDEN N.V.;DEN HAAG;DEN HAAG;Active;NETHERLANDS;ANNA VAN SAKSENLAAN, 71    
NFPEDEFF;NOMURA FINANCIAL PRODUCTS EUROPE GMBH;FRANKFURT AM MAIN;FRANKFURT AM MAIN;Active;GERMANY;RATHENAUPLATZ 1    
NFSAGB2L;NACIONAL FINANCIERA SNC;LONDON;ALL U.K. OFFICES;Active;UNITED KINGDOM;BISHOPSGATE 100   FLOOR 19
NFSCUS33;NATIONAL FINANCIAL SERVICES LLC;BOSTON;BOSTON;Active;United States;BOSTON    
NIBGGHAC;NATIONAL INVESTMENT BANK;ACCRA;ACCRA;Active;GHANA;KWAME NKRUMAH AVENUE, 37    
NIBIETAA;NIB INTERNATIONAL BANK S.C.;ADDIS ABABA;ADDIS ABABA;Active;ETHIOPIA;BOLE ROAD (AFRICA AVENUE)   DEMBEL BUILDING FLOOR 6
NIBPPKKA;MCB BANK LIMITED (FORMERLY NIB BANK LIMITED);KARACHI;MUHAMMADI HOUSE BR MAIN BR;Active;PAKISTAN;MUHAMMADI HOUSE BR MAIN BR
NICABEBB;CRELAN SA/NV (FORMERLY CREDIT AGRICOLE SA/LANDBOUWKREDIET NV);BRUSSELS;BRUSSELS;Active;Belgium;BRUSSELS    
NIKOLULL;SMBC NIKKO BANK (LUXEMBOURG) S.A.;LUXEMBOURG;LUXEMBOURG;Active;Luxembourg;LUXEMBOURG    
NINCKENA;NIC BANK LIMITED;NAIROBI;#N/A;Active;KENYA;#N/A
NINCUGKA;NCBA BANK UGANDA LIMITED;KAMPALA;KAMPALA;Active;UGANDA;RWENZORI TOWERS PLOT 6 - 7 NAKASERO ROAD   
NISLAEAD;DUBAI ISLAMIC BANK (FORMERLY NOOR BANK P.J.S.C.);DUBAI;HEAD OFFICE;Active;UNITED ARAB EMIRATES;HEAD OFFICE AL MAKTOUM STREET   
NISPIDJA;PT BANK OCBC NISP TBK;JAKARTA;JAKARTA;Active;INDONESIA;25 JL PROF DR SATRIO    
NJCBCNBN;BANK OF NANJING (FORMERLY NANJING CITY COMMERCIAL BANK);NANJING;NANJING;Active;China;NANJING    
NLCBTZTX;NATIONAL BANK OF COMMERCE, THE;DAR ES SALAAM;HEADOFFICE;Active;TANZANIA, UNITED REPUBLIC OF;HEADOFFICE    
NMBLZWHX;NMB BANK LIMITED;HARARE;HARARE;Active;ZIMBABWE;UNITY COURT FLOOR 1  CORNER UNION AVENUE/FIRST STREET 
NMIBTZTZ;NMB BANK PLC;DAR ES SALAAM;DAR ES SALAAM;Active;TANZANIA, UNITED REPUBLIC OF;OHIO STREET ALI HASSAN MWINYI RD   
NMRIUS33;NOMURA SECURITIES INTERNATIONAL INC.;NEW YORK;NEW YORK;Active;UNITED STATES OF AMERICA;WEST 49TH STREET, 309 WORLDWIDE PLAZA   
NMRSJPJT;NOMURA SECURITIES CO., LTD.;CHUO;TOKYO;Active;JAPAN;1-9-1 NIHONBASHI CHUO-KU   
NMTBJPJT;THE NOMURA TRUST AND BANKING CO., LTD.;CHIYODA;Head Office Sales Department;Active;Japan;Head Office Sales Department    
NOCUJPJT;NORINCHUKIN BANK, THE;CHIYODA;TOKYO;Active;JAPAN;OTEMACHI ONE TOWER FLOOR 7  2-1 OTEMACHI 1 CHIYODA-KU
NOCUSGSG;NORINCHUKIN BANK, THE;SINGAPORE;SINGAPORE BRANCH;Active;Singapore;SINGAPORE BRANCH    
NOINFIHH;NORDIC INVESTMENT BANK;HELSINKI;HELSINKI;Active;FINLAND;FABIANINKATU 34    
NOISSGSG;NOMURA INVESTMENTS (SINGAPORE) PTE;SINGAPORE;SINGAPORE;Active;Singapore;SINGAPORE    
NOLADE22;SPARKASSE OSNABRUECK;OSNABRUECK;Sparkasse Osnabrueck;Active;Germany;Sparkasse Osnabrueck    
NOLADE2H;NORDDEUTSCHE LANDESBANK GIROZENTRALE;HANNOVER;Nord LB Hannover;Active;Germany;Nord LB Hannover    
NOLAGB2L;NORDDEUTSCHE LANDESBANK GIROZENTRALE;LONDON;#N/A;Active;UNITED KINGDOM;#N/A
NOLALULL;NORD/LB LUXEMBOURG S.A. COVERED BOND BANK;LUXEMBOURG;FINDEL;Active;Luxembourg;FINDEL    
NOMAGB2LCLS;NOMURA INTERNATIONAL PLC;LONDON;CLS CONTROL BRANCH;Active;UNITED KINGDOM;ANGEL LANE 1   
NOMAGB2LPBR;NOMURA INTERNATIONAL PLC;LONDON;PRIME BROKERAGE SERVICES;Active;UNITED KINGDOM;ANGEL LANE 1   
NORDFRPP;SOCIETE GENERALE (FORMERLY CREDIT DU NORD);LILLE;AG FLANDRES;Active;France;AG FLANDRES    
NORHUS33;ATLANTIC COMMUNITY BANKERS' BANK;CAMP HILL;CAMP HILL;Active;UNITED STATES OF AMERICA;MARKET STREET, 1400    
NOSCAGAG;BANK OF NOVA SCOTIA,THE;ST. JOHN'S;ST. JOHN'S;Active;ANTIGUA AND BARBUDA;HIGH STREET    
NOSCBBBB;SCOTIABANK (BARBADOS) LIMITED;BRIDGETOWN;BRIDGETOWN;Active;Barbados;BRIDGETOWN    
NOSCBSNS;SCOTIABANK (BAHAMAS) LTD;NASSAU;NASSAU;Active;BAHAMAS;RAWSON SQUARE SCOTIABANK BUILDING   
NOSCBSNT;BANK OF NOVA SCOTIA TRUST COMPANY (BAHAMAS) LTD,THE;NASSAU;NASSAU;Active;BAHAMAS;EAST BAY STREET, 404 SCOTIA HOUSE   
NOSCBZBS;SCOTIABANK (BELIZE) LTD.;BELIZE CITY;BELIZE CITY;Active;BELIZE;ALBERT STREET    
NOSCCATT;THE BANK OF NOVA SCOTIA;TORONTO;ALL OFFICES IN CANADA;Active;CANADA;KING STREET WEST 44  SCOTIA BANK PLAZA 
NOSCCATTCLS;THE BANK OF NOVA SCOTIA;TORONTO;CONTINUOUS LINK SETTLEMENT;Active;CANADA;CONTINUOUS LINK SETTLEMENT    
NOSCCATTFXA;THE BANK OF NOVA SCOTIA;TORONTO;TORONTO;Active;CANADA;TORONTO    
NOSCCN22;BANK OF NOVA SCOTIA, THE;GUANGZHOU;Limited Guangzhou Branch;Active;China;Limited Guangzhou Branch    
NOSCCN22CKG;BANK OF NOVA SCOTIA, THE;CHONGQING;#N/A;Active;CHINA;#N/A
NOSCCRSJ;SCOTIABANK DE COSTA RICA;SAN JOSE;SAN JOSE;Active;COSTA RICA;AVENIDA LAS AMERICAS COSTADO N DEL ESTADIO NACIONAL - APARTADO 5395 -  SABANA NORTE 
NOSCDOSD;SCOTIABANK REPUBLICA DOMINICANA, S.A., BANCO MULTIPLE;SANTO DOMINGO;SANTO DOMINGO;Active;DOMINICAN REPUBLIC;AVE. 27 DE FEBRERO ESQ. W.CHURCHILL ENS. PIANTINI, DN   
NOSCGB22;BANK OF NOVA SCOTIA;LONDON;LONDON;Active;UNITED KINGDOM;BISHOPSGATE 201   FLOOR 6
NOSCGB22MOC;BANK OF NOVA SCOTIA;LONDON;SCOTIABANK COMMODITIES;Active;UNITED KINGDOM;BISHOPSGATE 201   FLOOR 6
NOSCGB2L;SCOTIABANK EUROPE PLC;LONDON;LONDON;Active;UNITED KINGDOM;BISHOPSGATE 201   FLOOR 6
NOSCGYGE;BANK OF NOVA SCOTIA,THE;GEORGETOWN;GEORGETOWN;Active;GUYANA;CARMICHAEL STREET 104   
NOSCHKHH;BANK OF NOVA SCOTIA, THE;CENTRAL;ADMIRALTY;Active;HONG KONG;QUEEUES ROAD CENTRAL TOWER  FLOOR 25 SUITE 2401 AND 2101
NOSCIE2X;SCOTIABANK (IRELAND) DESIGNATED ACTIVITY COMPANY;DUBLIN;DUBLIN;Active;IRELAND;I.F.S.C. HOUSE CUSTOM HOUSE QUAY   
NOSCINBB;BANK OF NOVA SCOTIA, THE;MUMBAI;RTGS-HO;Active;India;RTGS-HO    
NOSCJMKN;THE BANK OF NOVA SCOTIA JAMAICA LTD;KINGSTON;KINGSTON;Active;JAMAICA;DUKE AND PORT ROYAL STREETS SCOTIABANK CENTRE   
NOSCJPJT;BANK OF NOVA SCOTIA,THE;TOKYO;#N/A;Active;JAPAN;#N/A
NOSCKNSK;BANK OF NOVA SCOTIA,THE;BASSETERRE;Fort Street;Active;Saint Kitts and Nevis;Fort Street    
NOSCKRSE;BANK OF NOVA SCOTIA, THE, SEOUL BRANCH;SEOUL;SEOUL;Active;KOREA, REPUBLIC OF;SEJONGNO 139  DONG-A MEDIA CENTER FLOOR 16
NOSCKYKX;SCOTIABANK AND TRUST (CAYMAN) LTD.;GEORGETOWN;GEORGETOWN;Active;CAYMAN ISLANDS;FORUM LANE, 18   CAMANA BAY 
NOSCMYKL;THE BANK OF NOVA SCOTIA BERHAD;KUALA LUMPUR;#REF!;Active;MALAYSIA;JALAN P RAMLEE 1  MENARA HAP SENG 2 FLOOR 10
NOSCPR22;ORIENTAL BANK (FORMERLY SCOTIABANK PUERTO RICO);HATO REY;HATO REY;Active;PUERTO RICO;MUNOZ RIVERA 254   
NOSCSGSG;THE BANK OF NOVA SCOTIA, SINGAPORE BRANCH;SINGAPORE;SINGAPORE;Active;Singapore;SINGAPORE    
NOSCTTPS;SCOTIABANK TRINIDAD AND TOBAGO LTD.;PORT OF SPAIN;PORT OF SPAIN;Active;TRINIDAD AND TOBAGO;PARK AND RICHMOND STREETS   SCOTIA CENTRE 
NOSCUS33;BANK OF NOVA SCOTIA;NEW YORK;1 Liberty Plaza, 22-26 Fls;Active;United States;1 Liberty Plaza, 22-26 Fls    
NOSCUS33MT1;BANK OF NOVA SCOTIA;NEW YORK;NEW YORK;Active;United States;NEW YORK    
NOSCUS3S;SCOTIA CAPITAL USA INC;NEW YORK;NEW YORK,NY;Active;United States;NEW YORK,NY    
NOSCVIVI;BANK OF NOVA SCOTIA,THE;ST. THOMAS;ST. THOMAS;Active;Virgin Islands, U.S.;ST. THOMAS    
NOSRBMHM;NOMURA SECURITIES (BERMUDA) LIMITED;HAMILTON;HAMILTON;Active;BERMUDA;96 PITT'S BAY ROAD, 96 CHESNEY HOUSE G   
NOVHSCSC;NOUVOBANQ;VICTORIA;VICTORIA;Active;SEYCHELLES;STATE HOUSE AVENUE   VICTORIA HOUSE 
NRAKAEAK;NATIONAL BANK OF RAS AL-KHAIMAH, THE;RAS AL KHAIMAH;RAS AL KHAIMAH;Active;UNITED ARAB EMIRATES;NBRAK BUILDING SHEIKH MOHAMMED BIN ZAYED ROAD  AL RIFA AREA, EXIT NO. 129 
NRBLNPKA;NEPAL RASTRA BANK;KATHMANDU;KATHMANDU;Active;Nepal;KATHMANDU    
NRSBDK24;RINGKJOEBING LANDBOBANK A/S (FORMER NORDJYSKE BANK);NOERRESUNDBY;NOERRESUNDBY;Active;Denmark;NOERRESUNDBY    
NRTHUS33;TD BANK, N.A.;WILMINGTON;MOUNT LAUREL;Active;UNITED STATES OF AMERICA;ATRIUM WAY, 6000    
NRTTIQBA;NORTH BANK FOR FINANCIAL AND INVESTMENT;BAGHDAD;BAGHDAD;Active;Iraq;BAGHDAD    
NRWBDEDM;NRW. BANK;DUESSELDORF;NRW.BANK Duesseldorf;Active;Germany;NRW.BANK Duesseldorf    
NSDLINB1;NATIONAL SECURITIES DEPOSITORY LIMITED;MUMBAI;MUMBAI;Active;INDIA;TRADE WORLD FLOOR 4  KAMALA MILLS COMPOUND SENAPATI BAP
NTSIUS44;NORTHERN TRUST SECURITIES, INC.;CHICAGO;CHICAGO;Active;UNITED STATES OF AMERICA;SOUTH LASALLE ST, 50    
NURSKZKX;NURBANK JOINT STOCK COMPANY;ALMATY;ALMATY;Active;KAZAKHSTAN;ABAY AVENU 10V    
NVRBIT2N;BANCO POPOLARE SOC. COOP. (FORMERLY BANCA POPOLARE DI NOVARA);VERONA;#N/A;Active;ITALY;#N/A
NWBKGB2147K;NATIONAL WESTMINSTER BANK PLC;SOUTHAMPTON;SOUTHAMPTON, HIGH STREET BRANCH;Active;UNITED KINGDOM;Chatham RCSC    
NWBKGB2L;NATIONAL WESTMINSTER BANK PLC;LONDON;LONDON;Active;UNITED KINGDOM;BISHOPSGATE 250   
NWBKGB2LMCR;NATIONAL WESTMINSTER BANK PLC;MANCHESTER;INTERNATIONAL BANKING CENTRE MANCHESTER;Active;UNITED KINGDOM;MARBLE STREET 17  LOWRY HOUSE 
NWBKGB2LTSY;NATIONAL WESTMINSTER BANK PLC;LONDON;GLOBAL FINANCIAL MARKETS;Active;UNITED KINGDOM;90-100 SOUTHWARK STREET    
NWBKGB3C;NATIONAL WESTMINSTER BANK PLC;LONDON;LONDON;Active;UNITED KINGDOM;250 BISHOPSGATE    
NWBKGB3L;NATIONAL WESTMINSTER BANK PLC;LONDON;LONDON;Active;UNITED KINGDOM;BISHOPSGATE 250   
NWBKGBCH;NATIONAL WESTMINSTER BANK PLC;LONDON;CHAPS;Active;UNITED KINGDOM;250 BISHOPSGATE    
NWNBSGS1;WELLS FARGO BANK MINNESOTA NA;SINGAPORE;SINGAPORE;Active;Singapore;SINGAPORE    
NWSBGB21;NATWEST STOCKBROKERS LIMITED;LEEDS;LEEDS;Active;UNITED KINGDOM;MANSELL STREET 55   
NWSCUS33;DEUTSCHE BANK SECURITIES INC.;NEW YORK;NEW YORK;Active;UNITED STATES OF AMERICA;1 COLUMBUS CIRCLE    
NYCBCNSH;NANYANG COMMERCIAL BANK (CHINA), LIMITED;SHANGHAI;SHANGHAI;Active;China;SHANGHAI    
NYCBHKHH;NANYANG COMMERCIAL BANK LIMITED;CENTRAL;CENTRAL;Active;HONG KONG;DES VOEUX ROAD, 151    
NYKBDKKK;NYKREDIT BANK A/S;COPENHAGEN;COPENHAGEN;Active;DENMARK;KALVEBOD BRYGGE, 1-3    
OBKLAT2L;OBERBANK AG;LINZ;LINZ;Active;AUSTRIA;Untere Donaulaende 28    
OBKLDEMX;OBERBANK AG;MUENCHEN;Oberbank Muenchen;Active;Germany;Oberbank Muenchen    
OCBCCNSH;OCBC WING HANG BANK (CHINA) LIMITED (FORMERLY OCBC BANK (CHINA) LIMITED);SHANGHAI;SHANGHAI;Active;China;SHANGHAI    
OCBCHKHH;OVERSEA-CHINESE BANKING CORPORATION LTD.HK BRANCH (INCORP. WITH LIMITED LIABILITY IN SINGAPORE);CENTRAL;CENTRAL;Active;HONG KONG;QUEEUES ROAD, 9   FLOOR 9 
OCBCMYKL;OCBC BANK (MALAYSIA) BERHAD;KUALA LUMPUR;KUALA LUMPUR;Active;MALAYSIA;JALAN TUN PERAK 18  MENARA OCBC FLOOR 11
OCBCSGSG;OVERSEA-CHINESE BANKING CORPORATION LIMITED;SINGAPORE;OCBC Centre;Active;Singapore;OCBC Centre    
OCBCTHBK;OVERSEA-CHINESE BANKING CORPORATION LIMITED, BANGKOK BRANCH;BANGKOK;BANGKOK;Active;THAILAND;Q-HOUSE LUMPINI UNIT 2501 FLOOR 25  1 SOUTH SATHORN ROAD TUNGMAHAMEK, SATHORN
OCBCUS33;OVERSEA-CHINESE BANKING CORPORATION LIMITED;NEW YORK;New York Branch;Active;United States;New York Branch    
OCBKUS3M;OCEAN BANK;MIAMI;MIAMI;Active;UNITED STATES OF AMERICA;NORTHWEST 42ND STREET, 780    
OCCICOBC;BANCO DE OCCIDENTE;CALI;HEADQUARTERS;Active;COLOMBIA;CARRERA 4, 7-61   FLOOR 12 
OCCICOBCCL1;BANCO DE OCCIDENTE;CALI;BRANCH;Active;COLOMBIA;BRANCH    
OEKOATWW;OESTERREICHISCHE KONTROLLBANK AG;VIENNA;WIEN;Active;AUSTRIA;Am Hof 4    
OGAKJPJT;OGAKI KYORITSU BANK,LTD.,THE;OGAKI;Head Office Sales Department;Active;Japan;Head Office Sales Department    
OIBAINBB;DOHA BANK Q.S.C MUMBAI BRANCH;MUMBAI;MUMBAI;Active;India;MUMBAI    
OIBAOMMX;OMAN INTERNATIONAL BANK S.A.O.G.;MUSCAT;#N/A;Active;OMAN;#N/A
OKHBHUHB;K AND H BANK ZRT.(FORMERLY KERESKEDELMI ES HITELBANK RT);BUDAPEST;BUDAPEST;Active;Hungary;BUDAPEST    
OKOMATWW;KA FINANZ AG;VIENNA;WIEN;Active;Austria;WIEN    
OKOMCY2N;KOMMUNALKREDIT INTERNATIONAL BANK LTD;SUPE;#N/A;Active;CYPRUS;#N/A
OKOYFIHH;OP CORPORATE BANK PLC;HELSINKI;HELSINKI;Active;FINLAND;GEBHARDINAUKIO 1    
OLBODEH2;OLDENBURGISCHE LANDESBANK AG;OLDENBURG;HEAD OFFICE;Active;Germany;HEAD OFFICE    
OLBODEH2280;OLDENBURGISCHE LANDESBANK AG;OLDENBURG;BRANCH;Active;GERMANY;STAU 15-17    
OMABOMRU;OMAN ARAB BANK SAOG;RUWI;RUWI;Active;OMAN;RUWI OAB BUILDING  MUTTRAH BUSINESS DISTRICT 
OMDBSDKH;OMDURMAN NATIONAL BANK;KHARTOUM;KHARTOUM;Active;SUDAN;EL QASR STREET OMDURMAN NATIONAL BANK BUILDING   
OPCOUS33;CIBC WORLD MARKETS CORP.;NEW YORK;NEW YORK;Active;United States;NEW YORK    
OPILMWMW;OPPORTUNITY INTERNATIONAL BANK OF MALAWI;LILONGWE;LILONGWE;Active;MALAWI;LILONGWE
OPPOMEPG;ERSTE BANK AD PODGORICA;PODGORICA;PODGORICA;Active;MONTENEGRO;2A ARSENIJA BOLJEVICA    
OPPYUS33;OPPENHEIMER AND CO, INC.;NEW YORK;NEW YORK;Active;UNITED STATES OF AMERICA;BROAD STREET, 85    
OPTSNGLA;OPTIMUS BANK LIMITED;LAGOS;#N/A;Active;NIGERIA;#N/A
ORBCINBBIBD;PUNJAB NATIONAL BANK (E-OBC);GURGAON;ORIENATL BANK OF COMMERCE;Active;India;INTERNATIONAL BANKING DIVISION,HEAD OFFICE,NEW DELHI    
ORBKBFBF;ORABANK BURKINA-FASO;OUAGADOUGOU;OUAGADOUGOU;Active;BURKINA FASO;IMMEUBLE RESIDENCE AZIZ COTE SUD  620 AVENUE KWAME N'KRUMA 
ORBKGALI;ORABANK GABON;LIBREVILLE;LIBREVILLE;Active;GABON;BOULEVARD DE L'INDEPENDANCE   IMM. LES FRANGIPANIERS 
ORBKMLBA;ORABANK MALI;BAMAKO;BAMAKO;Active;Mali;BAMAKO    
ORINUGKA;I AND M BANK (UGANDA) LIMITED;KAMPALA;KAMPALA;Active;UGANDA;KAMPALA ROAD, 6/6A ORIENT PLAZA   
OSABJPJS;KANSAI MIRAI BANK, LIMITED;OSAKA;OSAKA;Active;JAPAN;2-1 BINGOMACHI, 2-CHOME CHUO-KU   
OTKRRUM1;OTKRITIE BROKERAGE HOUSE JSC;MOSCOW;MOSCOW;Active;Russian Federation;MOSCOW    
OTPVHUHB;OTP BANK PLC.;BUDAPEST;BUDAPEST;Active;Hungary;BUDAPEST    
OTPVSKBX;CESKOSLOVENSKA OBCHODNA BANKA, A.S. (FORMERLY OTP BANKA SLOVENSKO, A.S.);BRATISLAVA;BRATISLAVA;Active;SLOVAKIA;ZIZKOVA 11    
OURBTWTP;TA CHONG BANK LTD.;TAIPEI;TAIPEI;Active;TAIWAN, PROVINCE OF CHINA;TAIPEI
OWHBDEFF;VTB BANK (EUROPE) SE;FRANKFURT AM MAIN;FRANKFURT AM MAIN;Active;Germany;FRANKFURT AM MAIN    
OYAKDE5K;OYAK ANKER BANK GMBH;FRANKFURT AM MAIN;Oyak Anker Bank;Active;Germany;Oyak Anker Bank    
PABIPHMM;BANK OF COMMERCE;CITY OF MANDALUYONG;CITY OF MANDALUYONG;Active;PHILIPPINES;ST. FRANCIS STREET 7  SAN MIGUEL PROPERTIES CENTRE (SMPC) 
PACIECEG;BANCO DEL PACIFICO;GUAYAQUIL;HEAD OFFICE;Active;ECUADOR;FRANCISCO DE P. ICAZA Y PICHINC 200   
PAHAAZ22;PASHA BANK OJSC;BAKU;HEAD OFFICE;Active;Azerbaijan;HEAD OFFICE    
PALRZAJJ;ANGLORAND SECURITIES PTY LTD;JOHANNESBURG;JOHANNESBURG;Active;SOUTH AFRICA;JOHANNESBURG
PALSPS22;BANK OF PALESTINE PLC;RAMALLAH;RAMALLAH;Active;PALESTINE, STATE OF;COURT STREET EIN MESBAH    
PARBAU2S;BNP PARIBAS SECURITIES SERVICES, AUSTRALIA;SYDNEY;SYDNEY;Active;AUSTRALIA;60 CASTLEREAGH STREET    
PARBAU2SLCC;BNP PARIBAS SECURITIES SERVICES, AUSTRALIA;SYDNEY;SECURITIES SERVICES SYDNEY LOCAL CUSTODY;Active;AUSTRALIA;SECURITIES SERVICES SYDNEY LOCAL CUSTODY    
PARBBEBZ;BNP PARIBAS SECURITIES SERVICES, BELGIUM;BRUSSELS;BRUSSELS;Active;Belgium;BRUSSELS    
PARBCHZZ;BNP PARIBAS SECURITIES SERVICES ZURICH;ZUERICH;ZURICH;Active;Switzerland;ZURICH    
PARBDEFF;BNP PARIBAS SECURITIES SERVICES, GERMANY;FRANKFURT AM MAIN;BNP PARIBAS Sec Serv;Active;Germany;BNP PARIBAS Sec Serv    
PARBDEFFISI;BNP PARIBAS SECURITIES SERVICES, GERMANY;FRANKFURT AM MAIN;GLOBAL CUSTODY;Active;GERMANY;GLOBAL CUSTODY    
PARBESMX;BNP PARIBAS SECURITIES SERVICES, SPAIN;MADRID;MADRID;Active;Spain;MADRID    
PARBFRPP;BNP PARIBAS SECURITIES SERVICES, FRANCE;PARIS;AG SIEGE SOCIAL;Active;France;AG SIEGE SOCIAL    
PARBFRPPBEC;BNP PARIBAS SECURITIES SERVICES, FRANCE;PARIS;PARIS;Active;FRANCE;PARIS    
PARBGB2L;BNP PARIBAS SECURITIES SERVICES, UNITED KINGDOM;LONDON;LONDON;Active;UNITED KINGDOM;HAREWOOD AVENUE 10  MARYLEBONE GATE 
PARBGRAX;BNP PARIBAS SECURITIES SERVICES, GREECE;ATHENS;ATHENS;Active;GREECE;LAMPSAKOU STR, 2    
PARBHKHH;BNP PARIBAS SECURITIES SERVICES;QUARRY BAY;QUARRY BAY;Active;HONG KONG;KING'S ROAD, 979 TAIKOO PLACE, PCCW TOWER  FLOOR 21 EASTERN DISTRICT
PARBHUHX;BNP PARIBAS SECURITIES SERVICES HUNGARY BRANCH;BUDAPEST;BUDAPEST;Active;HUNGARY;TEREZ KORUT 55-57    
PARBITMM;BNP PARIBAS SECURITIES SERVICES, ITALY;MILANO;SEDE;Active;Italy;SEDE    
PARBJESH;BNP PARIBAS SECURITIES SERVICES S.C.A. JERSEY BRANCH;ST. HELIER;ST. HELIER;Active;JERSEY;THE ESPLANADE, 1 IFC   
PARBLULL;BNP PARIBAS SECURITIES SERVICES;LUXEMBOURG;LUXEMBOURG;Active;LUXEMBOURG;AVENUE J.F. KENNEDY, 60    
PARBPLPX;BNP PARIBAS SECURITIES POLAND;WARSZAWA;WARSZAWA;Active;POLAND;UL. WRONIA , 31    
PARBSGSG;BNP PARIBAS SECURITIES SERVICES SA;SINGAPORE;SINGAPORE;Active;SINGAPORE;TUNG CENTRE 20 COLLYER QUAY   
PARXLV22;JSC CITADELE BANKA;RIGA;RIGA;Active;LATVIA;REPUBLIKAS LAUKUMS , 2A    
PASCITMM;BANCA MONTE DEI PASCHI DI SIENA S.P.A.;SIENA;HEAD OFFICE;Active;Italy;HEAD OFFICE    
PASCITMMARE;BANCA MONTE DEI PASCHI DI SIENA S.P.A.;AREZZO;SUCC. DI AREZZO;Active;Italy;SUCC. DI AREZZO    
PASCITMMBAR;BANCA MONTE DEI PASCHI DI SIENA S.P.A.;BARI;BARI;Active;Italy;BARI    
PASCITMMTER;BANCA MONTE DEI PASCHI DI SIENA S.P.A.;TERNI;SUCC. DI TERNI;Active;Italy;SUCC. DI TERNI    
PASCITMMTSY;BANCA MONTE DEI PASCHI DI SIENA S.P.A.;MILANO;HEAD OFFICE FINANCE ADMINISTRATIVE DEPARTMENT;Active;Italy;HEAD OFFICE FINANCE ADMINISTRATIVE DEPARTMENT    
PAUTKENA;PARAMOUNT BANK LIMITED;NAIROBI;NAIROBI;Active;KENYA;WOODVALE GROOVE SOUND PLAZA  FLOOR 4 
PBANUA2X;JSC CB PRIVATBANK;KYIV;KYIV;Active;Ukraine;KYIV    
PBBEMYKL;PUBLIC BANK BERHAD;KUALA LUMPUR;KUALA LUMPUR;Active;MALAYSIA;JALAN AMPANG 146  MENARA PUBLIC BANK 
PBBRBRSP;BANCO PINE S.A.;SAO PAULO;SAO PAULO;Active;BRAZIL;CONDOMINIO SAO LUIZ TORRE 4 FLOOR 6  AV. PRES. JUSCELINO KUBITSCHEK 1830 ITAIM BIBI
PBFSUS33;JEFFERIES FINANCIAL SERVICES INC;NEW YORK;NEW YORK;Active;United States;NEW YORK    
PBNKDEFF;DEUTSCHE BANK AG-POSTBANK BRANCH (FORMERLY DEUTSCHE POSTBANK AG);BONN;FRANKFURT BRANCH;Active;Germany;FRANKFURT BRANCH    
PBNKDEFF380;DEUTSCHE BANK AG-POSTBANK BRANCH (FORMERLY DEUTSCHE POSTBANK AG);BONN;BONN,TREASURY;Active;GERMANY;FRIEDERICH EBERT ALLEE 114/126    
PBNKDEFF590;DEUTSCHE BANK AG-POSTBANK BRANCH (FORMERLY DEUTSCHE POSTBANK AG);SAARBRUECKEN;SAARBRUECKEN BRANCH;Active;GERMANY;NEUGRABENWEG 2    
PBOCSGSG;INVESTMENT COMPANY OF THE PEOPLE'S REPUBLIC OF CHINA (SINGAPORE) PTE LTD., SINGAPORE;SINGAPORE;SINGAPORE;Active;Singapore;SINGAPORE    
PBPEIDJ1;PT. BNP PARIBAS SECURITIES INDONESIA;JAKARTA;JAKARTA;Active;INDONESIA;MENARA BATAVIA FLOOR 20  126 JL. KH MAS MANSYUR 
PBZATZTZ;PEOPLE'S BANK OF ZANZIBAR, THE;ZANZIBAR;ZANZIBAR;Active;TANZANIA, UNITED REPUBLIC OF;STONE-TOWN    
PBZGHR2X;PRIVREDNA BANKA ZAGREB D.D.;ZAGREB;ZAGREB;Active;Croatia;ZAGREB    
PCBCAU2S;CHINA CONSTRUCTION BANK CORPORATION SYDNEY BRANCH;SYDNEY;SYDNEY;Active;AUSTRALIA;PHILLIP STREET 88   FLOOR 31
PCBCCHZZCLR;CHINA CONSTRUCTION BANK CORPORATION, BEIJING, SWISS BRANCH ZURICH;ZUERICH;SWISS RMB CLEARING CENTER;Active;SWITZERLAND;BEETHOVENSTRASSE    
PCBCCNBJ;CHINA CONSTRUCTION BANK CORPORATION;BEIJING;BEIJING;Active;China;BEIJING    
PCBCCNBJBJX;CHINA CONSTRUCTION BANK CORPORATION;BEIJING;BEIJING BRANCH;Active;CHINA;28 XUANWUMEN WEST STREET   ENTRY 4 BUILDING FLOOR 8
PCBCCNBJGPS;CHINA CONSTRUCTION BANK CORPORATION;BEIJING;GLOBAL PAYMENT SERVICES;Active;CHINA;GLOBAL PAYMENT SERVICES    
PCBCCNBJGSX;CHINA CONSTRUCTION BANK CORPORATION;LANZHOU;GANSU BRANCH;Active;CHINA;GANSU BRANCH    
PCBCCNBJHAX;CHINA CONSTRUCTION BANK CORPORATION;ZHENGZHOU;HENAN BRANCH;Active;CHINA;HENAN BRANCH    
PCBCCNBJHPX;CHINA CONSTRUCTION BANK CORPORATION;HUBEI;HUBEI BRANCH;Active;CHINA;HUBEI BRANCH    
PCBCCNBJHUX;CHINA CONSTRUCTION BANK CORPORATION;HUNAN;HUNAN BRANCH;Active;CHINA;2, Baisha Road    
PCBCCNBJJXX;CHINA CONSTRUCTION BANK CORPORATION;NANCHANG;JIANGXI BRANCH;Active;CHINA;1259 JINGANG ROAD ECONOMIC DEVELOPMENT ZONE  BAISHUIHU INDUSTRIAL PARK 
PCBCCNBJLNH;CHINA CONSTRUCTION BANK CORPORATION;HULUDAO;HULUDAO BRANCH;Active;CHINA;34 LONGWAU STREET LONGGANG DISTRICT   
PCBCCNBJNPX;CHINA CONSTRUCTION BANK CORPORATION;NINGBO;NINGBO BRANCH;Active;CHINA;NINGBO BRANCH    
PCBCCNBJQDX;CHINA CONSTRUCTION BANK CORPORATION;QINGDAO;QINGDAO BRANCH;Active;CHINA;71, Guizhou Road    
PCBCCNBJSDZ;CHINA CONSTRUCTION BANK CORPORATION;ZIBO;ZIBO BRANCH;Active;CHINA;12 XINCUN WEST ROAD    
PCBCCNBJSHX;CHINA CONSTRUCTION BANK CORPORATION;SHANGHAI;SHANGHAI BRANCH;Active;CHINA;292, Shenbo Road    
PCBCCNBJZJS;CHINA CONSTRUCTION BANK CORPORATION;SHAOXING;SHAOXING BRANCH;Active;CHINA;6 RENMIN ROAD    
PCBCCNBJZJX;CHINA CONSTRUCTION BANK CORPORATION;HANGZHOU;ZHEJIANG BRANCH;Active;CHINA;290 TI YU CHANG ROAD    
PCBCDEFF;CHINA CONSTRUCTION BANK;FRANKFURT AM MAIN;FRANKFURT BRANCH;Active;Germany;FRANKFURT BRANCH    
PCBCGB2B;CHINA CONSTRUCTION BANK CORPORATION LONDON BRANCH;LONDON;LONDON;Active;UNITED KINGDOM;OLD BROAD STREET, 111    
PCBCGB2BCLR;CHINA CONSTRUCTION BANK CORPORATION LONDON BRANCH;LONDON;CLEARING BANK;Active;UNITED KINGDOM;111 OLD BROAD    
PCBCGB2L;CHINA CONSTRUCTION BANK (LONDON) LIMITED;LONDON;LONDON;Active;UNITED KINGDOM;OLD BROAD STREET 111   
PCBCGB2LCLR;CHINA CONSTRUCTION BANK (LONDON) LIMITED;LONDON;CLEARING;Active;UNITED KINGDOM;111 OLD BROAD    
PCBCHKHH;CHINA CONSTRUCTION BANK CORPORATION;CENTRAL;CENTRAL;Active;HONG KONG;CONNAUGHT ROAD, 3 CCB TOWER  FLOOR 28 
PCBCKRSE;CHINA CONSTRUCTION BANK SEOUL BRANCH;SEOUL;SEOUL;Active;KOREA, REPUBLIC OF;MYUNGDONG GIL 24, 11  CHINA CONSTRUCTION BANK TOWER 
PCBCRUMM;LLC 'CHINA CONSTRUCTION BANK';MOSCOW;MOSCOW;Active;Russian Federation;MOSCOW    
PCBCSGSG;CHINA CONSTRUCTION BANK CORPORATION, SINGAPORE BRANCH;SINGAPORE;SINGAPORE;Active;SINGAPORE;RAFFLES PLACE, 9 REPUBLIC PLAZA  33 01
PCBCUS33;CHINA CONSTRUCTION BANK NEW YORK BRANCH;NEW YORK;New York Branch;Active;United States;New York Branch    
PCBCZAJJ;CHINA CONSTRUCTION BANK CORPORATION JOHANNESBURG BRANCH;JOHANNESBURG;SANDTON;Active;SOUTH AFRICA;95 GRAYSTON DRIVE FLOOR 5   
PCHQBEBB;BPOST;BRUSSELS;BRUSSELS;Active;Belgium;BRUSSELS    
PERLGB2L;PERSHING SECURITIES LIMITED;LIVERPOOL;LIVERPOOL;Active;United Kingdom;LIVERPOOL    
PERLJESH;PERSHING (CHANNEL ISLANDS) LIMITED;ST. HELIER;ST. HELIER;Active;JERSEY;ST ANDREWS PLACE, CHARING CROSS, 5    
PFSICAM1;PENSON FINANCIAL SERVICES CANADA INC.;MONTREAL;MONTREAL;Active;CANADA;360 ST.JACQUES WEST SUITE 1213   
PFSIUS44;PENSON FINANCIAL SERVICES;DALLAS,TX;#N/A;Active;UNITED STATES;#N/A
PHAREGCA;AL AHLY PHAROS SECURITIES BROKERAGE,SAE;CAIRO;CAIRO;Active;Egypt;CAIRO    
